State,Product,District,LGD Code,Category,Sector,Description,GI Status,Photo,Ministry/ Department
Madhya Pradesh,Bamboo,Rewa,424,Primary,Handicraft,"Bamboo from Rewa district of Madhya Pradesh is a beautiful and versatile natural resource that has been used for various purposes for centuries. With its strong and flexible qualities, it is often used for making furniture, handicrafts, baskets, mats, and even buildings. The bamboo from Rewa district is known for its durability and strength, making it ideal for construction purposes. In addition to being strong, the bamboo from Rewa also has an attractive appearance with a natural sheen and a beautiful greenish-yellow color.",No,https://drive.google.com/file/d/1CdG-_e8Fvpp0KKqXp7dH6dAdfyDU2kdA/view?usp=drive_link,DC Handicraft
Madhya Pradesh,Farm Equipment,Sagar,425,Primary,Manufacturing,"Sagar district in Madhya Pradesh is known for its agricultural practices and produces a variety of crops. The district has also made a significant contribution to the agricultural machinery sector. The region is home to skilled craftsmen who create a range of farming equipment using locally available materials. From traditional plows and harvesters to modern machines, Sagar's farming equipment has helped the farmers in the region improve their efficiency and increase their yields.",No,https://drive.google.com/file/d/1u3E3S68_-10UBaB3pkqSYHePHuxRpi2y/view?usp=drive_link,MSME
Madhya Pradesh,Tomato,Satna,426,Primary,Agriculture,"Satna district, located in the northeastern region of Madhya Pradesh, is known for its high-quality tomatoes that are grown in abundance in its fertile soil. The tomatoes from Satna are juicy, flavorful, and have a bright red color that adds a visual appeal to any dish. The farmers in Satna use traditional and organic farming methods, ensuring that the tomatoes are free from harmful pesticides and chemicals, making them a healthy option for consumption.",No,https://drive.google.com/file/d/1NeQl38TPgKUPSs_knhili6KD00c3D4Ut/view?usp=drive_link,Ministry of Agriculture & Farmers' Welfare
Madhya Pradesh,Wooden Toys and Handicraft,Sehore,427,Primary,Handicraft,"Sehore district in Madhya Pradesh is famous for its exquisite wooden toys and handicrafts. The craftsmen of Sehore have been creating stunning wooden toys and handicrafts for generations using traditional techniques and skills passed down from their ancestors. The toys and handicrafts are made from high-quality wood, which is carefully selected to ensure durability and longevity. The wooden toys are known for their intricate designs and beautiful craftsmanship, and they are often painted with bright and vibrant colors.",No,https://drive.google.com/file/d/1pFJ2AforRd2J5TQxUNH9_CJpiFEKWTY3/view?usp=drive_link,DC Handicraft
Madhya Pradesh,Cilantro,Seoni,428,Primary,Agriculture,"Cilantro, also known as coriander, from Seoni district of Madhya Pradesh is a herb with a refreshing aroma and a distinctive flavor. It is widely used in Indian cuisine as a garnish or a key ingredient in curries, chutneys, and salads. The cilantro from Seoni district is known for its freshness and quality, with bright green leaves that are full of flavor. The herb is grown in the region's fertile soil, where it receives ample sunlight and nutrients, resulting in a herb that is bursting with aroma and taste.",No,https://drive.google.com/file/d/173KWefW-m0a76cgGzo_uQU1ThiMRtuRv/view?usp=drive_link,Ministry of Agriculture & Farmers' Welfare
Madhya Pradesh,Turmeric,Shahdol,429,Primary,Agriculture,"Turmeric, a perennial herb that belongs to the ginger family, is a precious spice that is widely grown in the lush green fields of Shahdol district in Madhya Pradesh. With its beautiful yellow hue, turmeric adds a burst of color and a distinctive aroma to any dish. The rich and earthy flavor of turmeric has made it a popular ingredient in Indian cuisine for centuries. The turmeric cultivated in Shahdol district is known for its superior quality and high curcumin content, which is the active ingredient responsible for its health benefits.",No,https://drive.google.com/file/d/1XhXfQOTbvNT644j2gX8_x8R_9rNfeVyN/view?usp=drive_link,Ministry of Agriculture & Farmers' Welfare
Madhya Pradesh,Onion,Shajapur,430,Primary,Agriculture,"Shajapur district of Madhya Pradesh is known for its high-quality onions that are renowned for their pungent flavor, distinctive aroma, and numerous health benefits. These onions are carefully cultivated in nutrient-rich soil, using traditional farming methods and are renowned for their excellent taste and long shelf-life. They are an essential ingredient in Indian cuisine and are used in a variety of dishes to enhance their flavor and aroma.",No,https://drive.google.com/file/d/1wBjAy3ZTUPLLef98y1235R_EnJejlJXt/view?usp=drive_link,Ministry of Agriculture & Farmers' Welfare
Madhya Pradesh,Guava,Sheopur,431,Primary,Agriculture,"Guava from Sheopur district of Madhya Pradesh is a delightfully fragrant fruit that is known for its sweet, juicy flesh and tropical aroma. The Sheopur guava is grown in the heart of the Indian subcontinent, where the warm, humid climate provides the perfect conditions for this fruit to flourish. Its smooth, green skin covers the soft, pinkish-white flesh that is filled with tiny, edible seeds. The Sheopur guava is not only delicious but also packed with nutrients, making it a healthy addition to any diet.",No,https://drive.google.com/file/d/1Jiy9U9dwz3A1uktk7QMPkwdsaOMmWOis/view?usp=drive_link,Ministry of Agriculture & Farmers' Welfare
Madhya Pradesh,Cloth Jacket,Shivpuri,432,Primary,Textile,"Cloth jackets are carefully made by skilled artisans using high-quality fabrics, resulting in a product that is not only functional but also highly fashionable. The intricate designs and patterns add an elegant touch to the jacket, making it suitable for both casual and formal occasions. The durable fabric used in the production of these jackets ensures they last for a long time, making it an ideal investment piece for those looking for a stylish and practical addition to their wardrobe.",No,https://drive.google.com/file/d/12R_KWXYRhrbIe1eufxBtdyDMHsikfVqj/view?usp=drive_link,Ministry of Textile
Madhya Pradesh,Carpet (Panja Dari),Sidhi,433,Primary,Handicraft,"Sidhi district of Madhya Pradesh is known for its exquisite carpets that are handwoven by skilled artisans using traditional techniques. These carpets are made from high-quality wool and feature intricate designs and patterns that are inspired by the rich cultural heritage of the region. The carpets of Sidhi are renowned for their durability and excellent craftsmanship. They are available in a range of colors and sizes, making them suitable for use in a variety of settings, from traditional to modern.",No,https://drive.google.com/file/d/1kVn6IBaK-U37bt9b99nIXP9NRu9mwyKY/view?usp=drive_link,DC Handicraft
Madhya Pradesh,Kodo Kutki (Millet),Singrauli,638,Primary,Agriculture,"Kodo and Kutki are two types of millet grains that have been widely cultivated in the Singrauli district of Madhya Pradesh. These millets are known for their rich nutritional content and health benefits. Kodo and Kutki are gluten-free and provide high amounts of dietary fiber, protein, and essential minerals like iron, calcium, and phosphorus. Kodo and Kutki are versatile grains that can be used to prepare a variety of dishes such as porridge, upma, pulao, and even desserts. They have a nutty and slightly sweet flavor that adds a unique taste to the dish.",No,https://drive.google.com/file/d/1o9HKUG00pzc0SqyZOhUdWGJ1N4GvwKJq/view?usp=drive_link,Ministry of Agriculture & Farmers' Welfare
Madhya Pradesh,Ginger,Tikamgarh,434,Primary,Agriculture,"Ginger from Tikamgarh district of Madhya Pradesh is a unique and aromatic spice that adds a zesty kick to any dish. It is commonly used in Indian cuisine to add a warm and earthy flavor to curries, stews, and soups. The ginger roots are harvested and dried before being sold, ensuring that the essential oils and natural flavor are preserved. The rich soil and favorable climate of Tikamgarh district provide ideal growing conditions for ginger, making it one of the most sought-after spices in the region.",No,https://drive.google.com/file/d/1qBQXTkeoglrNVY8AGCLPGFQcrc-FF7CM/view?usp=drive_link,Ministry of Agriculture & Farmers' Welfare
Madhya Pradesh,Batik print,Ujjain,435,Primary,Textile,"Batik print involves a combination of wax resist dyeing and and painting. The batik print is characterized by intricate designs and patterns that are created by applying wax to the fabric in specific areas, which resist the dye and create a beautiful contrast when the fabric is dyed. The skilled artisans of Ujjain create stunning batik print sarees, dress materials, and other textiles, which are not only aesthetically pleasing but also reflect the rich cultural heritage of the region.",Yes,https://drive.google.com/file/d/1OPF5YwmaXptDaxLN92GYOJXdPyrV84Yx/view?usp=drive_link,Ministry of Textile
Madhya Pradesh,Mahua,Umaria,436,Primary,Food Processing,"Mahua is known for its sweet, floral fragrance and has been an important part of the local culture and economy for centuries. The flowers of the mahua plant are used to produce a rich, nutty-tasting oil that is commonly used in cooking, as well as in the production of soaps and cosmetics. In addition, the flowers are fermented to create a popular alcoholic beverage known as mahua wine. The plant also has several medicinal properties and is used to treat a variety of ailments, from respiratory problems to skin diseases.",No,https://drive.google.com/file/d/1fHoColXn-ed--KB7ew0r6uVPZ14WMI8G/view?usp=drive_link,Ministry of Food Processing
Madhya Pradesh,Farm Equipment,Vidisha,437,Primary,Manufacturing,"Vidisha district of Madhya Pradesh is well-known for its innovative and efficient farm equipment. The farmers in this district are highly skilled in designing and manufacturing a range of equipment that cater to different agricultural needs, including ploughing, sowing, harvesting, and threshing. Some of the commonly used farm equipment in Vidisha district are seed drills, cultivators, harrows, threshers, and ploughs. These tools are designed to suit the specific soil types and cropping patterns in the region, making them highly effective in improving crop yields and reducing labour costs.",No,https://drive.google.com/file/d/17s4a9I0y87SjYHPLvvjjY7-iWuTWCAH4/view?usp=drive_link,MSME
Maharashtra,Cane Sugar,Ahmednagar,466,Primary,Food Processing,"Ahmednagar is the largest district in the state, and the birthplace of the cooperative movement with a large number of sugar cooperatives and factories. Ever since, the district has been a major producer of sugar with the processing and refinement of the product taking place here.",No,https://drive.google.com/file/d/1fZtjAuyBQPiYa31jIiHEh-lDLtuGwOgt/view?usp=drive_link,Ministry of Food Processing
Maharashtra,Dairy Products (Milk based products),Ahmednagar,466,Secondary,Dairy,"Ahmednagar is a major dairy producer with many plants engaged in the the processing of milk into various products like ghee, cheese, curd and more. The districts boast advanced units that are able to process the milk into products that are ready to ship and be sold to consumers.",No,https://drive.google.com/file/d/1uftWETsW-ujz4unAvEMW33WEzjL3F-10/view?usp=drive_link,"Ministry of Fisheries, Animal Husbandry and Dairying"
Maharashtra,Cotton Ginning and pressing,Akola,467,Primary,Textile,"The district of Akola is a home to a large industry of cotton related products, owing to its position as one of the largest cotton producing regions of the state. This has given it the name of the 'Cotton City' of India. This cotton is plucked, processed and made into a variety of textiles, garments and furnishings and much more.",No,https://drive.google.com/file/d/1CDeGm4-x4qh2cU_7d5B_pIkW-e_51Fww/view?usp=drive_link,Ministry of Textile
Maharashtra,Pulses (Daal),Akola,467,Secondary,Agriculture,"Akola Pulses (Daal) are a rich source of protein, fibre, and other essential nutrients. Pulses are widely grown in the district and are an important part of the Indian diet. They are used to make a variety of dishes, such as Daal Fry, Daal Makhani, and Sambar. Pulses are also used to make flour, which is used to make bread, pancakes, and other baked goods.",No,https://drive.google.com/file/d/1uqZlB0TC6K9UWZ-DLKDfizYs1LmCHbV2/view?usp=drive_link,Ministry of Agriculture & Farmers' Welfare
Maharashtra,Textile,Amravati,468,Primary,Textile,"Amravati district in Maharashtra is known for its textile industry. The district is home to several textile mills that produce a wide range of fabrics and yarns. These produce a variety of textiles in the form of garments, furnishings and other clothes.",No,https://drive.google.com/file/d/1fWOosJKas8ipVgyivZIqw30dvxYMfYgO/view?usp=drive_link,Ministry of Textile
Maharashtra,Mandarin Orange,Amravati,468,Secondary,Agriculture,"Nestled in the verdant embrace of Maharashtra's Amravati district, the Mandarin Orange emerges as a radiant jewel of the region's agricultural splendor. This citrus fruit is cherished for its refreshing sweetness, balanced with a slight tang, making it a delightful treat. Amravati's favorable climate and rich soil contribute to the exceptional quality of these oranges, which are prized for their juicy texture and aromatic zest.",No,https://drive.google.com/file/d/1emp7HQJOjmQEehWhYie7k8WaIPC4vzdN/view?usp=drive_link,Ministry of Agriculture & Farmers' Welfare
Maharashtra,Marathwada Kesar Mango,Aurangabad,377,Primary,Agriculture,The Marathwada Kesar Mango is a variety of mango enriched with more pulp as compared to many other mango varieties and is relatively cheaper than Alphonso and other types of mangoes. The district is known for its mangoes and is a major producer of the fruit.,Yes,https://drive.google.com/file/d/1KYMwsSnByPwAnmXbQdxVUmobIVjITc7V/view?usp=drive_link,Ministry of Agriculture & Farmers' Welfare
Maharashtra,Auto components,Aurangabad,377,Secondary,Manufacturing,"Aurangabad district in Maharashtra is not just a historical gem but also a thriving hub for automotive excellence. The city boasts a robust ecosystem for auto component manufacturing, pulsating with innovation, craftsmanship, and cutting-edge technology. The region's rich industrial heritage, coupled with its skilled workforce, makes it a magnet for automotive companies seeking excellence in quality and precision.",No,https://drive.google.com/file/d/1pkb233vvILQnIp-KhtXTR6r-tBfLwCUR/view?usp=drive_link,MSME
Maharashtra,Cotton and cotton seed oil,Beed,470,Primary,Food Processing,"The Beed district in Maharashtra is known for its cotton and cotton seed oil production. The district produces large quantities of cotton that are used for the production of textiles and oil. Cottonseed oil is a commonly used vegetable oil thats derived from the seeds of cotton plants, and is also produced in Beed.",No,https://drive.google.com/file/d/1CUgpU--f8t_VEgpa4EPjd_8CWog_3d6h/view?usp=drive_link,Ministry of Food Processing
Maharashtra,Beed Custard Apple,Beed,470,Secondary,Agriculture,"Beed Custard Apple, also known as the ""Queen of Fruits,"" hails from the lush orchards of Beed district in Maharashtra, India. Renowned for its exquisite taste and creamy texture, this fruit is a symbol of the region's agricultural bounty. These apples are a must-have for fruit enthusiasts and connoisseurs alike. Whether enjoyed fresh or used in desserts and beverages, this fruit never fails to impress.",Yes,https://drive.google.com/file/d/1U4xs5Lc0ZQ3LBWP_lAemRHn7JCHHemJO/view?usp=drive_link,Ministry of Agriculture & Farmers' Welfare
Maharashtra,Rice,Bhandara,471,Primary,Agriculture,"Bhandara district is popular for its large production of rice and popularly referred as the 'Rice Bowl of Maharashtra. The district has large scale cultivation and production of rice, with many mills involved in the processing of the rice.",Yes,https://drive.google.com/file/d/1BFAF3T0P8PcaujHOc0zys_Q44r4sJxE0/view?usp=drive_link,Ministry of Agriculture & Farmers' Welfare
Maharashtra,Mineral based products,Buldhana,472,Secondary,Others,"Bhandara district in Maharashtra is a treasure trove of mineral-based products, offering a rich palette of resources that embody the region's geological diversity. From its expansive reserves of coal, known for its high quality and purity, to its deposits of manganese, quartz, and limestone, Bhandara's mineral wealth forms the backbone of the local economy.",No,https://drive.google.com/file/d/1vHD2BmsI_m_wBb3SpSlmjOTxU9QYsWVb/view?usp=drive_link,Ministry of mines
Maharashtra,Cotton Related products,Buldhana,472,Primary,Agriculture,"Buldhana is a producer of cotton-related products, with cotton grown, cultivated and processed in the district. The cotton is then used to create a variety of end products such as garments, textiles and other materials used for large-scale production.",No,https://drive.google.com/file/d/1EteHZVVTjrtaHGPLNzBTqpKboJrMJLcm/view?usp=drive_link,Ministry of Agriculture & Farmers' Welfare
Maharashtra,Seeds for planting,Buldhana,472,Secondary,Agriculture,"Seeds from the Buldhana district in Maharashtra embody the rich agricultural heritage of the region, where generations have nurtured the land with care and wisdom. They hold the potential to transform lands into lush green fields, promising vibrant flora. As these seeds are planted, they carry with them the legacy of hard work, perseverance, and the belief that from tiny seeds, mighty harvests grow.",No,https://drive.google.com/file/d/1BF9S1rprvrB6ZaPlqvWxLhdDti11la9Q/view?usp=drive_link,Ministry of Agriculture & Farmers' Welfare
Maharashtra,Rice,Chandrapur,473,Primary,Agriculture,"Chandrapur is considered one of the major rice producers of the state with a variety of rice being cultivated. These include Basmati Rice, Long Grain Rice, Kranti Rice, Permal Rice and Parboiled Rice. These are then processed and packaged for sale to consumers in the district and beyond.",No,https://drive.google.com/file/d/1bpd0gBQp8m4iGcnHCQ12J4OH3fGkXF7v/view?usp=drive_link,Ministry of Agriculture & Farmers' Welfare
Maharashtra,Bamboo Products,Chandrapur,473,Secondary,Handicraft,"From the traditional craftsmanship of indigenous communities weaving sturdy baskets and elegant mats to the contemporary production of eco-friendly furniture and dcor, Chandrapurs bamboo heritage is deeply interwoven with its cultural fabric. Today, Chandrapur is a thriving center for bamboo products, celebrated for their sustainability, versatility, and artistry. The districts abundant bamboo forests fuel a vibrant cottage industry, empowering artisans and supporting rural livelihoods. With skill passed down through generations and innovation shaping modern designs, Chandrapurs bamboo craftsmen continue to transform this green resource into creations that are both timeless and relevant",No,https://drive.google.com/file/d/1uUiSkSJErb3CHtuk9l31GdkID3aFuqeO/view?usp=sharing,DC Handicraft
Maharashtra,De-Oiled Cake,Dhule,474,Primary,Food Processing,"Dhule is known for its production and processing of cotton into Cotton seed oil cakes. These oil cakes have around 8% oil content with a higher percentage translating to a better quality oil cake. Oil cakes have been widely used for the production of industrial enzymes, antibiotics, biopesticides, vitamins and other biochemicals.",No,https://drive.google.com/file/d/1SbM35VmpnzFe6XOdm2xHRgP7AwwnUTUg/view?usp=drive_link,Ministry of Food Processing
Maharashtra,Textile,Dhule,474,Secondary,Textile,"Textile in Dhule district, Maharashtra, is a vibrant tapestry of tradition, innovation, and cultural richness. From the rhythmic clacking of looms to the kaleidoscope of colors adorning fabrics of cotton, silk fabrics, and colorful tie-and-dye fabrics, Dhule's textile industry is a testament to the skill and artistry of its people. The region has embraced modern technology and sustainable practices for the global market while preserving its heritage.",No,https://drive.google.com/file/d/1va_2532OnVV3DyVQbQY9C4zmvEAykq-j/view?usp=drive_link,Ministry of Textile
Maharashtra,Rice,Gadchiroli,475,Primary,Agriculture,"Some of the popular varieties of rice grown in the region include HMT, Kolam, Ambemohar, and Sona Masuri. The rice is processed using modern technology to maintain its nutritional value and quality. The rice from Gadchiroli is also known for its organic cultivation practices, which are gaining popularity among health-conscious consumers.",No,https://drive.google.com/file/d/1BFAF3T0P8PcaujHOc0zys_Q44r4sJxE0/view?usp=drive_link,Ministry of Agriculture & Farmers' Welfare
Maharashtra,Forest products,Gadchiroli,475,Secondary,Agriculture,"In the heart of Maharashtra lies the enchanting district of Gadchiroli, a land abundant in natural treasures. The diverse range of forest products includes aromatic oils, medicinal herbs, and nutritious seeds, all harvested sustainably by local communities. These products not only support livelihoods but also hold cultural significance, woven into the fabric of daily life through rituals, crafts, and cuisine.",No,https://drive.google.com/file/d/1nwjci1zFYokOyXYMDWiPbWlKW7aOiyF3/view?usp=drive_link,Ministry of Agriculture & Farmers' Welfare
Maharashtra,Rice,Gondia,476,Primary,Agriculture,"Gondia district in Maharashtra is a major producer of rice with many rice mills in the district. From the cultivation to processing, rice is a big part of the district's produce, with demand from across the state. The region is famous for its aromatic varieties of rice such as Ambemohar, Kolam, and Mahamaya, which are highly sought after for their unique flavors and fragrances.",No,https://drive.google.com/file/d/1bpd0gBQp8m4iGcnHCQ12J4OH3fGkXF7v/view?usp=drive_link,Ministry of Agriculture & Farmers' Welfare
Maharashtra,Bamboo Articles,Gondia,476,Secondary,Handicraft,"The Bamboo articles of Gondia are not merely products; they are a testament to the craftsmanship and artistry deeply rooted in this land. From intricately woven baskets to sturdy furniture, every creation is a blend of traditional techniques and contemporary designs, reflecting the dynamic spirit of this region. By promoting these articles, we not only celebrate Gondia's artistic legacy but also support its eco-friendly ethos.",No,https://drive.google.com/file/d/1VgfsEqHrmcLVfX8vSncuxptLehvBXlY-/view?usp=drive_link,DC Handicraft
Maharashtra,Turmeric,Hingoli,477,Primary,Agriculture,Hingoli district in Maharashtra is the largest producer of turmeric in the state. The district has a huge area used for turmeric cultivation and produces an average of over a lakh metric tonnes of spice every year. The district and the nearby regions produce a significant chunk of the Selam variety of turmeric which is highly popular.,No,https://drive.google.com/file/d/1chS4M-5hNg5sLIHCSsrkw7iISaP2FQLI/view?usp=drive_link,Ministry of Agriculture & Farmers' Welfare
Maharashtra,Soyabean and soyabean based products,Hingoli,477,Secondary,Food Processing,"The sun-kissed fields of soybean stretch out like golden carpets, painting the landscape with a hue of prosperity in the Hingoli district of Maharashtra. Soybean, known for its versatility and nutritional value, finds a perfect home in the rich soils of Hingoli. As the season progresses, the fields of soybean transform, each plant bearing the promise of a bountiful harvest.",No,https://drive.google.com/file/d/1cFaPoHp0rawrSHmzSUsEEmtSDo-9GXXp/view?usp=drive_link,Ministry of Food Processing
Maharashtra,Jalgaon Banana,Jalgaon,478,Primary,Agriculture,"Jalgaon is known as the Banana City of Maharashtra as it contributes approximately two-thirds of Maharashtras banana production. The Jalgaon bananas have gained the GI (Geographical Indication) Mark in 2016 with the region known for its unique variety of bananas, which are grown using drip irrigation. The banana production in Jalgaon district has been increasing over the years, and the district has become a hub for banana-value added products.",Yes,https://drive.google.com/file/d/1EcfqC5YfAuX7pEQK2bSGaPhEZ8nGlBNe/view?usp=drive_link,Ministry of Agriculture & Farmers' Welfare
Maharashtra,Plastic PVC Pipes,Jalgaon,478,Secondary,Manufacturing,"Plastic PVC pipes represent a modern solution catering to the diverse infrastructure needs of Jalgaon district, Maharashtra. From efficient water distribution networks to sustainable agricultural practices and urban development, these pipes epitomize resilience and sustainability. They are durable, designed to withstand harsh environmental conditions, have leak-proof construction, and are cost-effective and sustainable. Plastic PVC pipes have emerged as a cornerstone technology, revolutionizing the region's water management, agriculture, and urban infrastructure.",No,https://drive.google.com/file/d/1JmkcAGvRrmh9HxxPqCaNw65SJXfRUC-k/view?usp=drive_link,MSME
Maharashtra,Sweet Orange,Jalna,479,Primary,Agriculture,"A symphony of flavors unfolds with the arrival of the sweet oranges in Maharashtra's Jalna district. These citrus gems, nurtured by the region's rich soil and gentle sunshine, are renowned for their exquisite taste and vibrant hues. Each orange is a testament to the meticulous care taken by local farmers, who have perfected the art of cultivating these juicy delights over generations.",Yes,https://drive.google.com/file/d/1bKkYOOrh6UaGM4n18w2YHcHTdQGJ_fw8/view?usp=drive_link,Ministry of Agriculture & Farmers' Welfare
Maharashtra,TMT Steel Bars,Jalna,479,Secondary,Manufacturing,"The Jalna district is known for its TMT steel bars. TMT bars in Jalna are made from iron ore, coal, and dolomite as raw materials, and used in construction and have abrasion resistance, long functional life, weld consistency, high performance, rust-free nature, and great strength.",No,https://drive.google.com/file/d/11KV86ZH-L_z-b1E3GjmJW0qnZtTmew76/view?usp=drive_link,MSME
