State,Product,District,LGD Code,Category,Sector,Description,GI Status,Photo,Ministry/ Department
Rajasthan,Wooden Furniture Products,Sikar,114,Primary,Handicraft,"Antique furniture from Sikar district of Rajasthan is a stunningly beautiful and valuable art form that reflects the region's rich cultural heritage and history. The district is known for its intricate and exquisite wooden furniture, which features unique designs and motifs that have been passed down through generations of skilled craftsmen. The furniture is made from the highest quality hardwoods, including teak, rosewood, and mango wood, which are expertly carved and finished to create elegant and timeless pieces. Each antique piece of furniture is a true work of art, with intricate carvings and designs that showcase the skill and creativity of Rajasthan's master craftsmen.",No,https://drive.google.com/file/d/1TM94e8MDrz15z_TSuTUQb2tzhsdpb7K3/view?usp=drive_link,DC Handicraft
Rajasthan,Marble Products ,Sirohi,115,Primary,handicraft,"Marble articles from Sirohi district of Rajasthan are a stunningly beautiful and elegant form of artwork that showcase the region's rich cultural heritage and artistic traditions. The district is renowned for its high-quality marble, which is expertly carved and finished by skilled craftsmen to create intricate and delicate designs. Marble articles from Sirohi are available in a wide range of designs and styles, from traditional motifs to more contemporary patterns, with each piece showcasing the skill and creativity of Rajasthan's master craftsmen. The natural beauty of the marble, combined with the intricate designs and attention to detail, make these articles a true work of art.",No,https://drive.google.com/file/d/13EUdwarhilum1e7Ojyq3h4sl-QuoRz3J/view?usp=drive_link,DC Handicraft
Rajasthan,Mustard Oil ,Sri Ganganagar,100,Primary,Food Processing,"Sri Ganganagar, located in Rajasthan, is a prominent region formustard oil production. Known for its fertile agricultural land, the district is a major producer of high-quality mustard seeds, which are cold-pressed to extract pure and aromatic mustard oil. Sri Ganganagar's mustard oil is celebrated for itsrich flavor,pungent aroma, andhealth benefits, making it a staple in Indian cooking. The region's oil mills adhere to traditional extraction methods while incorporating modern technology to ensure quality. Sri Ganganagar's mustard oil is widely distributed across Rajasthan and beyond, contributing significantly to the local economy.",NO ,https://drive.google.com/file/d/1clnCs67l0teA5ELV_yuVbIMAsMUoGPU6/view?usp=drive_link,Ministry of Food Processing
Rajasthan,Stale stone tiles,Tonk,116,Primary,Manufacturing,"Tonk district in Rajasthan is known for its high-quality slate stone tiles, which are widely used in construction and interior decoration. These tiles are valued for their durability, natural texture, and aesthetic appeal. Available in various shades like grey, green, and multi-color, Tonks slate stone tiles are ideal for flooring, wall cladding, and roofing. Their weather-resistant and non-slip properties make them a popular choice for both indoor and outdoor applications. The region's rich slate deposits and skilled craftsmanship contribute to the growing demand for these tiles in domestic and international markets.",No,https://drive.google.com/file/d/1eaCVPPWoealQ7RvyzLAN9VIV2jgMFXT1/view?usp=drive_link,MSME
Rajasthan,Marble and Granite products ,Udaipur,117,Primary,Manufacturing,"Udaipur, Rajasthan, is a global hub forgranite and marble products, known for its high-quality stone and skilled craftsmanship. Famous forMakrana marble(used in the Taj Mahal), Udaipur produces durable and elegant marble and granite for construction, sculptures, flooring, and tiles. The industry is a key economic driver, supporting local artisans and exporting worldwide, reflecting Rajasthan's royal heritage.",No,https://drive.google.com/file/d/19cepbUeVgjC58MKS1Xz-GRrYZgjhQ_sh/view?usp=drive_link,MSME
Sikkim,Tourism,East Sikkim (Gangtok),225,Primary,Others,"Gangtok is the capital city of Sikkim and a popular tourist destination known for its beautiful landscape and peaceful surroundings. Some popular places to visit include the Rumtek Monastery, Tsomgo Lake, and Banjhakri Falls. The city is known for its vibrant festivals like Losar, Bumchu, and Pang Lhabsol. Panoramic scenes of Kanchenjunga range can be enjoyed from viewpoints.",No,https://drive.google.com/file/d/1raWm828KGx5Vylxc5vA1aPYhVfXIkGSm/view?usp=drive_link,Ministry of Tourism
Sikkim,Pharma related,East Sikkim (Gangtok),225,Secondary,Others,"Gangtok, the capital city of Sikkim, is home to several pharmaceutical companies, which form an essential part of the state's industrial sector. These companies manufacture a wide range of medicines and pharmaceutical products, including traditional Tibetan medicines, using locally sourced herbs and other natural ingredients.",No,https://drive.google.com/file/d/1KThCBYMS140rSOgV_skwRRpugZ6ymppn/view?usp=drive_link,Department of Pharmaceuticals
Sikkim,Handloom and Handicraft,East Sikkim (Gangtok),225,Tertiary,Handicraft,"In the serene hills of Gangtok district in Sikkim, traditional craftsmanship thrives in the form of exquisite handloom and handicrafts. Skilled weavers meticulously craft intricate designs on fabrics like cotton, wool, and silk, creating mesmerizing shawls, wraps, and carpets. Artisans carve wood into stunning sculptures, fashion bamboo into functional art pieces, and mold clay into pottery that is both utilitarian and beautiful.",No,https://drive.google.com/file/d/1gALNouwIqo4tLv0eqcBQTb9MujtvzYCS/view?usp=drive_link,DC Handicraft
Sikkim,Buck Wheat,North Sikkim (Mangan),226,Primary,Agriculture,"Buckwheat, grown in the Indian state of Sikkim, is a nutritious and versatile grain known for its earthy flavor and high protein content. It's a great alternative to traditional wheat and is gluten-free. It is often used in pancakes, noodles, and as a rice substitute.",No,https://drive.google.com/file/d/1mDsDKhfqAIcjXgwZOyAfbhGhojaXnWoR/view?usp=drive_link,Ministry of Agriculture & Farmers' Welfare
Sikkim,Orange,North Sikkim (Mangan),226,Secondary,Agriculture,"Mangan, in North Sikkim, is known for its flourishing orange orchards. The region's favorable climate and soil make it ideal for the cultivation of oranges. Oranges grown in the region are a major contributor to the local economy, and the town hosts an annual Orange Festival that celebrates the fruit and its significance in the region.",No,https://drive.google.com/file/d/1tqb5a2iv4XzIA62q50vFhaU_3FTd4YMr/view?usp=drive_link,Ministry of Agriculture & Farmers' Welfare
Sikkim,Sikkim Large Cardamom,North Sikkim (Mangan),226,Tertiary,Agriculture,"Cardamom, also known as Elaichi, is a spice grown in North Sikkim. It is known for its unique, aromatic flavor and is used in various cuisines worldwide. Cardamom is used as a spice in baking, curries, and as a flavoring for coffee and tea. It is also believed to have medicinal properties.",Yes,https://drive.google.com/file/d/1xZV-vxie3HRSlyLfH3pv-TnLjYzfXidW/view?usp=drive_link,Ministry of Agriculture & Farmers' Welfare
Sikkim,Handloom and Handicraft,North Sikkim (Mangan),226,Others,Handloom,"In the Mangan district of Sikkim, the artistry of handloom and handicrafts thrives amidst the majestic backdrop of the Himalayas. The traditional Buddhist scroll paintings, functional items from bamboo and cane, handwoven carpets and rugs and exquisite jewelry pieces are some unique creations of the skilles artists of Mangan. Each piece is a labor of love, reflecting the heritage and creativity of the people of Sikkim.",No,https://drive.google.com/file/d/1gALNouwIqo4tLv0eqcBQTb9MujtvzYCS/view?usp=drive_link,DC Handloom
Sikkim,Floriculture,Pakyong,741,Primary,Agriculture,"Pakyong in East Sikkim is well-known for its successful floriculture industry, with many nurseries and flower farms growing a wide range of flowers. The favorable climatic conditions of the region allow for the cultivation of orchids, gladioli, and carnations. The industry provides jobs to locals and the flowers are exported. Pakyong is also home to the Pakyong Airport, the main airport for Sikkim",No,https://drive.google.com/file/d/1ESTPuqnOlKC3BFlPn1xsKHDehZqXKBYA/view?usp=drive_link,Ministry of Agriculture & Farmers' Welfare
Sikkim,Sikkim Large Cardamom,Pakyong,741,Secondary,Agriculture,"Pakyong is a small town in East Sikkim that is well-known for its cardamom plantations. Cardamom is a highly valued spice, and the plantations in Pakyong are a significant contributor to the local economy. The cardamom grown in Pakyong is of high quality and is used in many local dishes and sold in markets throughout India and beyond.",Yes,https://drive.google.com/file/d/1PnOssZDPaxkApuecIISVGPuLi646hvPW/view?usp=drive_link,Ministry of Agriculture & Farmers' Welfare
Sikkim,Dalle Khursani,Pakyong,741,Tertiary,Agriculture,"Dalle chillies are extremely hot chilies grown in Sikkim. They are known to be one of the spiciest chilies in the world and are often used in traditional dishes to add heat and flavor. They are also used to make hot sauces, powder, and oil. The Dalle chilli is used in traditional medicine to treat stomach issues and to relieve pain.",Yes,https://drive.google.com/file/d/1CsdEpIRhO2e9rrx2QX1u7dqTr-SIV0gw/view?usp=drive_link,Ministry of Agriculture & Farmers' Welfare
Sikkim,Handloom and Handicraft,Pakyong,741,Others,Handloom,"In the lush hills of Pakyong district in Sikkim, the artistry of handloom and handicrafts weaves a vibrant narrative of tradition and skill. Skilled artisans deftly maneuver looms to create intricate patterns and designs, using locally sourced materials like wool, silk, and cotton. From intricate wood carvings to colorful pottery and carpets, each creation is a masterpiece of creativity.",No,https://drive.google.com/file/d/1M2aCf_o8D9o2MH_j1Q-mWgogDOqkK9Pu/view?usp=drive_link,DC Handloom
Sikkim,Sikkim Large Cardamom,Soreng,742,Primary,Agriculture,"Soreng, located in West Sikkim, is known for its large cardamom plantations. Large cardamom is a highly valued spice and is grown extensively in the region, making it an important contributor to the local economy. The cardamom grown in Soreng is known for its unique flavor and aroma.",Yes,https://drive.google.com/file/d/1lTBaTms3Czq84MW3G7nuUFXddU2IWeKW/view?usp=drive_link,Ministry of Agriculture & Farmers' Welfare
Sikkim,Animal Husbandry related products,Soreng,742,Secondary,Food Processing,"Soreng, a town in West Sikkim, is known for its animal husbandry industry. The town is a significant center for rearing livestock such as cattle, goats, and sheep, and animal husbandry is an essential source of income for the locals. Soreng has several dairy cooperatives that supply milk and dairy products to other parts of Sikkim.",No,https://drive.google.com/file/d/147mEvUdOjxBpxb7Kuq26mHVlC1E1KW2x/view?usp=drive_link,Ministry of Food Processing
Sikkim,Dalle Khursani,Soreng,742,Tertiary,Agriculture,"While Dalle chillies are primarily grown in the southern region of Sikkim around Namchi, they are also grown in other parts of the state, including Soreng in West Sikkim. Soreng is known for its thriving agricultural industry, and the cultivation of Dalle chillies is an important part of this. The chillies are grown on small farms and sold fresh or dried and are used in many local dishes",Yes,https://drive.google.com/file/d/1dtchusl5_pufCjIf8gu-u8A4Lc5C1_Yq/view?usp=drive_link,Ministry of Agriculture & Farmers' Welfare
Sikkim,Handloom and Handicraft,Soreng,742,Others,Handloom,"The handloom industry in Soreng district is renowned for its intricate weaves and vibrant colors. Skilled artisans create mesmerizing fabrics like the Sikkimese thara, a traditional wraparound dress, and the choktse, a decorative cloth used in rituals and ceremonies. Bamboo and cane crafts are particularly popular, with artisans weaving baskets, mats, and furniture that are not just functional but also beautiful works of art.",No,https://drive.google.com/file/d/1HMIA0PXtpcqWeCOP-5iJg4NgPFrMBnQL/view?usp=drive_link,DC Handloom
Sikkim,Tea,South Sikkim (Namchi),227,Primary,Agriculture,"Blessed with region's high altitude, cool climate, and unique soil conditions, the tea produced in Namchi is known for its unique flavor and aroma. Namchi tea is mostly grown using organic farming methods and is often used in making blends of tea. The tea industry also plays an important role in the local economy, providing employment opportunities to the residents of the region.",No,https://drive.google.com/file/d/1p5ke0iQFUSycwJZSh1fW8TBMfUQskmDq/view?usp=drive_link,Ministry of Agriculture & Farmers' Welfare
Sikkim,Dalle Khursani,South Sikkim (Namchi),227,Secondary,Agriculture,"Dalle chillies are a famous variety of hot pepper native to the Sikkim region of India. The chillies are known for their unique flavor and high heat, making them an essential ingredient in many local dishes. The cultivation of Dalle chillies is a significant contributor to the local economy in Sikkim, particularly in the southern region around Namchi. The chillies are grown on small farms and are typically sold fresh or dried, and are also used to make pickles, chutneys, and sauces.",Yes,https://drive.google.com/file/d/15E261Q0b4p7TBCOaB5scCtclkaMOijZk/view?usp=drive_link,Ministry of Agriculture & Farmers' Welfare
Sikkim,Handloom and Handicraft,South Sikkim (Namchi),227,Tertiary,Handloom,"With skilled weavers using traditional techniques to craft intricate designs on fabrics like cotton, silk, and wool, the handloom and handicrafts industry in Namchi dustrict of Sikkim not only preserves age-old techniques but also provides sustainable livelihoods to many local artisans. From intricately carved wooden artifacts to colorful Tibetan Thangka paintings, each piece reflects the rich cultural tapestry of Sikkim.",No,https://drive.google.com/file/d/1lnvhcQfXNRZab5gPCCq5uYAQ5KnsI_Zd/view?usp=drive_link,DC Handloom
Sikkim,Tourism,West Sikkim (Geyzing),228,Primary,Others,"The town of Geyzing is known for its natural beauty, rich culture, and historical significance. Tourist activities include trekking, paragliding, visiting monasteries, and experiencing the local culture. It's also a hub of cardamom plantation, traditional art, and culture. Known for its unique culture, festivals, and natural beauty, Geyzing is a popular destination for both domestic and international tourists.",No,https://drive.google.com/file/d/1YZjp82prCYIS-QSRvSJq0UOgKt0GCJD9/view?usp=drive_link,Ministry of Tourism
Sikkim,Trout Fishing,West Sikkim (Geyzing),228,Secondary,Marine,"Geyzing is home to several cold water streams and rivers that are stocked with rainbow and brown trout. The town of Geyzing offers anglers the opportunity to catch trout in a picturesque mountain setting. Trout fishing is a popular activity for both locals and tourists, and the region is known for its well-stocked rivers and streams. Visitors can also try out different methods of fishing like fly fishing and spin fishing.",No,https://drive.google.com/file/d/1ceFTKGVYaXMaDtJnSSet5NBKeL1ml36G/view?usp=drive_link,Department of fisheries
Sikkim,Handloom and Handicraft,West Sikkim (Geyzing),228,Tertiary,Handloom,"In the realm of handicrafts and handlooms, Geyzing of Sikkim district boasts a rich tapestry of artistic expression. The intricate patterns and vibrant colors of these textiles often depict motifs inspired by nature, folklore, and spiritual beliefs like the Pangden, a woven cloth used for traditional attire. From intricately carved wooden artifacts to exquisitely crafted metalwork, each piece reflects the dedication and skill of its creator.",No,https://drive.google.com/file/d/1lnvhcQfXNRZab5gPCCq5uYAQ5KnsI_Zd/view?usp=drive_link,DC Handloom
Tamil Nadu,Cashew Processing,Ariyalur,610,Primary,Food Processing,"Embark on a journey through the refined art of cashew production in Ariyalur, Tamil Nadu. Carefully harvested and sun-dried, the cashew kernels achieve perfect moisture balance. Skillful removal of tough outer shells reveals succulent kernels, which are expertly roasted for enhanced flavor and texture. Graded and elegantly packaged, these cashews are a treat for culinary connoisseurs. Interesting fact: Cashews are not nuts but unique seeds found at the bottom of the cashew apple, adding to their distinctive charm!",No,https://drive.google.com/file/d/12jVFs6bs9Rn6Y-_3FHDVwCmhFSW0ykYy/view?usp=drive_link,Ministry of Food Processing
Tamil Nadu,Automobile products,Chengalpattu,730,Primary,Manufacturing,"Discover the bustling automobile products industry in Chengalpattu, Tamil Nadu. Renowned for their superior quality, the manufacturers here specialize in crafting a diverse range of components and accessories for vehicles. From engine parts and brake components to steering systems and electrical components, every product is meticulously designed and manufactured. These automotive products from Chengalpattu are esteemed for their durability, reliability, and efficiency, making them a preferred choice among customers both at home and abroad.",No,https://drive.google.com/file/d/1IZ8wLvTBN52xjRF3p4sIiXYUFpFEWkZs/view?usp=drive_link,MSME
Tamil Nadu,Engineering and Auto components,Chennai,568,Primary,Manufacturing,"Chennai, Tamil Nadu is a hub for engineering and auto components manufacturing, producing a diverse range of high-quality products for various industries. The region's manufacturers specialize in designing and producing precision-engineered components such as bearings, gears, pistons, valves, and other critical parts that are integral to the efficient functioning of machines and vehicles.",No,https://drive.google.com/file/d/1mcjI5grE1hpDdI0bBwlY57xOQbkK2asK/view?usp=drive_link,MSME
Tamil Nadu,Motor Pumps,Coimbatore,569,Primary,Manufacturing,"Coimbatore, located in the southern Indian state of Tamil Nadu, boasts a rich and storied legacy in the motor pumps industry. Its thriving manufacturing ecosystem produces a diverse range of precision-engineered motor pumps that cater to a wide spectrum of applications across sectors. The motor pumps are designed to exacting standards using state-of-the-art technology, ensuring top-notch quality and reliability.",No,https://drive.google.com/file/d/1W8NkXXHFwKDqKhHTRjN1gLcTNBFVaXu_/view?usp=drive_link,MSME
Tamil Nadu,Cashew Nuts,Cuddalore,570,Primary,Agriculture,"Behold, the exquisite cashew of Cuddalore district in the southern state of Tamil Nadu! This delectable delicacy is a true masterpiece of nature, boasting a rich and buttery flavor that will tantalize your taste buds and leave you yearning for more. Carefully nurtured by skilled farmers in the lush and fertile lands of Cuddalore, this nutty treasure is renowned for its exceptional quality and unparalleled taste.",No,https://drive.google.com/file/d/1KRz8wNuwQQenWo301s9W-5u7SgMdqR4o/view?usp=drive_link,Ministry of Agriculture & Farmers' Welfare
Tamil Nadu,Ready Made Garments,Dharmapuri,571,Primary,Textile,"Dharmapuri, a vibrant city located in the southern state of Tamil Nadu, is renowned for its exquisite ready-made garments that reflect the region's rich cultural heritage and superior craftsmanship. The region's textile industry produces a wide range of apparel, including traditional sarees, salwar kameez, and other fashionable attire. The garments are made with the finest quality fabrics and are embellished with intricate designs and patterns that are a testament to the region's artistic prowess.",No,https://drive.google.com/file/d/1uB09NkGfqV7t2N7a2krpt5pZsAiGYMpj/view?usp=drive_link,Ministry of Textile
Tamil Nadu,Auto Components,Dharampuri,571,Secondary,Manufacturing,"Discover the thriving auto components industry in Dharmapuri. With skilled workers who have honed their expertise, the region produces a wide range of high-quality components for automobiles. From engines to suspensions and brakes, these components meet stringent industry standards. Trusted by car manufacturers and owners, the auto components from Dharmapuri are known for their reliability, durability, and exceptional performance, ensuring a smooth and efficient driving experience.",No,https://drive.google.com/file/d/1nMGIKxAip8bba0Tb3_FhFc6u9jNLsqjb/view?usp=drive_link,MSME
Tamil Nadu,Coir Pith Blocks,Dindigul,572,Primary,Manufacturing,"Dindigul, a city located in the southern state of Tamil Nadu, is renowned for its exceptional coir pith blocks, which are acclaimed for their superior quality and sustainability. The region's coir industry produces these blocks by meticulously processing coconut husks, which are a byproduct of the coconut industry. The coir pith blocks are widely used in horticulture and agriculture as a natural soil conditioner and fertilizer, as they are rich in nutrients, moisture-retentive, and eco-friendly.",No,https://drive.google.com/file/d/1YCiy93XV5dUDUtlY5Uxe-Hu8HfxoqxUh/view?usp=drive_link,MSME
Tamil Nadu,Garlic,Dindigul,572,Secondary,Agriculture,"Dindigul, known for its fertile soils and favorable climate, yields an abundance of flavorful garlic. Renowned for its pungent aroma and robust flavor, Dindigul's garlic is sought after for its culinary excellence and medicinal properties. From traditional recipes to modern cuisine, Dindigul's garlic adds depth and richness to dishes, embodying the region's agricultural prowess and culinary heritage.",No,https://drive.google.com/file/d/1bmV2wDVFoyvs9Yhg9Qlb2oYmge91pdSK/view?usp=drive_link,Ministry of Agriculture & Farmers' Welfare
Tamil Nadu,Dindigul Locks,Dindigul,572,Tertiary,Manufacturing,"The Dindigul locks, a testament to the unparalleled craftsmanship of the region's skilled artisans. These locks, crafted from the finest brass and steel, are renowned worldwide for their robustness and intricate design. The artisans, who have honed their skills over generations, create these masterpieces that provide security and safety to homes and businesses alike.",Yes,https://drive.google.com/file/d/1Cvh-gyDqOXvMWsfo4HycsheF9pT-lonf/view?usp=drive_link,MSME
Tamil Nadu,Handloom and Powerloom products,Erode,573,Primary,Textile,"Erode, a city located in the southern state of Tamil Nadu, is a hub for handloom and powerloom products, which are renowned for their exquisite craftsmanship and quality. The region's textile industry produces a wide range of apparel and home furnishings, including sarees, dhotis, bed sheets, and curtains. The handloom and powerloom products are made with the finest quality fabrics, and each piece is embellished with intricate designs and patterns that showcase the region's artistic heritage.",No,https://drive.google.com/file/d/1OfmNptQoE-4tjpJILt2SSm3oDovv0ucu/view?usp=drive_link,Ministry of Textile
Tamil Nadu,Turmeric,Erode,573,Secondary,Agriculture,"The turmeric produced in Erode is renowned for its vibrant color and potent health benefits, making it a staple in Indian cuisine and traditional medicine. The local farmers use organic methods to cultivate the turmeric, ensuring that it is free from harmful chemicals and additives.",Yes,https://drive.google.com/file/d/1D8H6ZcTx80481nLGPBnNQVmgJC4Ra1ej/view?usp=drive_link,Ministry of Agriculture & Farmers' Welfare
Tamil Nadu,Readymade Fabric,Erode,573,Tertiary,Textile,"Erode, hailed for its textile manufacturing, boasts a thriving industry in readymade fabric production. Renowned for its quality and variety, Erode's fabrics cater to diverse tastes and preferences. From casual wear to formal attire, these fabrics are crafted with precision and care, reflecting the region's expertise in textile manufacturing. Erode's readymade fabric industry stands as a testament to its rich textile heritage and commitment to excellence.",No,https://drive.google.com/file/d/1SYLi0mM35tCzeYyaA4rFwhb4DQmVqDlB/view?usp=drive_link,Ministry of Textile
Tamil Nadu,Food products - Rice,Kallakurichi,729,Primary,Food Processing,"Kallakurichi, a region located in the southern state of Tamil Nadu, is renowned for its superior quality rice, which is acclaimed for its exquisite taste, aroma, and texture. The region's fertile soil, coupled with its conducive climate and traditional agricultural practices, yields a wide variety of rice that is highly sought after by discerning customers worldwide. The rice from Kallakurichi is carefully harvested, sun-dried, and milled to perfection, ensuring that each grain is packed with flavor and nutrients.",No,https://drive.google.com/file/d/1mr_Zzb6disHQXO-MnGIEZE1_JJpTh08e/view?usp=drive_link,Ministry of Food Processing
Tamil Nadu,Textiles and Garments,Kancheepuram,574,Primary,Textile,"Kancheepuram, a city located in the southern Indian state of Tamil Nadu, is renowned for its exquisite textiles and garments that reflect the region's rich cultural heritage and superior craftsmanship. The region's textile industry produces a diverse range of fabrics, including silk and cotton, that are renowned for their quality and elegance. The fabrics are skillfully woven and embellished with intricate designs and patterns that showcase the region's artistic prowess.",No,https://drive.google.com/file/d/1EkxdJCDaHRoRJk0KXdH92FXWwOfh2fHe/view?usp=drive_link,Ministry of Textile
Tamil Nadu,Kancheepuram Silk,Kancheepuram,574,Secondary,Handloom,"Adorn yourself with the timeless beauty of Kanchipuram silk sarees. Crafted by skilled artisans, these sarees are woven using traditional techniques passed down through generations, resulting in exquisite works of art. The silk is sourced from the finest silkworms, naturally dyed, and woven into stunning designs that embody the rich cultural heritage of the region. Kanchipuram silk sarees are known for their durability and can last for generations with proper care, making them cherished heirlooms.",Yes,https://drive.google.com/file/d/1G0ZALe_sVtFvnxOH7ZJdCt2gddqrNwW_/view?usp=drive_link,DC Handloom
