State,Product,District,LGD Code,Category,Sector,Description,GI Status,Photo,Ministry/ Department
Gujarat,Granite and Marble Blocks,Banaskantha,441,Primary,Manufacturing,"The Granite and Marble Blocks from Banaskantha, Gujarat are a true marvel of nature, boasting a rich and intricate tapestry of colors, patterns, and textures, each one telling a story of the natural world. Whether hewn into stately monuments, intricate sculptures, or sleek modern designs, Banaskantha's granite and marble blocks stand as a timeless tribute to the beauty and complexity of the world around us.",No,https://drive.google.com/file/d/134K8YHSroxTmItcn5FioOFmcTd2L7XQT/view?usp=drive_link,MSME
Gujarat,Food Processing/Milk Preparation,Banaskantha,441,Secondary,Food Processing,"Banaskantha, in Gujarat, stands out for its advanced food processing and milk preparation industries, rooted in the region's rich dairy farming heritage. It is renowned for producing high-quality dairy products, including milk, cheese, and yogurt, utilizing state-of-the-art processing techniques that ensure purity, nutritional value, and flavor. This district exemplifies the successful integration of traditional knowledge with modern technology, contributing significantly to India's dairy sector.",No,https://drive.google.com/file/d/1b9Y_WIe2oRYvLmljiOQq-1RidkjBfKbn/view?usp=drive_link,Ministry of Food Processing
Gujarat,Soof Embroidery/Applique,Banaskantha,441,Tertiary,Handloom,"Crafted using fine threads and intricate needlework techniques, each Soof embroidery creation is a magnificent tapestry of colors, patterns, and textures that embody the essence of Gujarat's vibrant and colorful lifestyle. Whether adorning a traditional garment or a modern fashion accessory, soof embroidery adds a touch of rustic elegance to any outfit.",Yes,https://drive.google.com/file/d/1YIsRaY8HogdsO7d7SHyWFuQwhawTruPZ/view?usp=drive_link,DC Handloom
Gujarat,"Chemicals (Chemicals,Agro Chemicals, Pesticide, Pharmaceutical, API)",Bharuch,442,Primary,Others,"Chemicals from Bharuch, Gujarat are a shining example of the modern industrial landscape, blending cutting-edge technology and innovation with a commitment to excellence and sustainability. From agro chemicals that help nourish and protect crops to pharmaceuticals and APIs that support the health and well-being of people around the world, each product is a testament to the skill and expertise of the local workforce.",No,https://drive.google.com/file/d/1xBp8ByV_HA4xtwa-II3lZWYVHbjyzWd-/view?usp=drive_link,Department of Chemicals and Petrochemicals
Gujarat,Sujani,Bharuch,442,Secondary,Handloom,"Sujani, a traditional embroidery art from Bharuch, Gujarat, is a mesmerizing display of artistry and skill, that has been passed down through generations. Each sujani piece is imbued with a unique personality and story, as skilled artisans infuse their own creative expression into every stitch. From elegant wall hangings to exquisite clothing and accessories, sujani is a timeless masterpiece that continues to enchant and inspire all who behold it.",Yes,https://drive.google.com/file/d/1JOuUhGyBAEXy8T0z7qQPEpszyTQckFfM/view?usp=drive_link,DC Handloom
Gujarat,Dehydrated Vegetables (Onion),Bhavnagar,443,Primary,Food Processing,"Bhavnagar, in Gujarat, is esteemed for its production of premium-quality dehydrated onions, a staple in culinary endeavors worldwide. Through meticulous processing techniques, Bhavnagar preserves the onions' flavor, aroma, and nutritional content, ensuring a long shelf life without compromising quality. These dehydrated onions serve as a convenient ingredient in various dishes, representing Bhavnagar's dedication to delivering exceptional agricultural products that enhance culinary experiences globally.",No,https://drive.google.com/file/d/13ZdLmvK0J1C6oHrbdPACDFnK4VYzecsd/view?usp=drive_link,Ministry of Food Processing
Gujarat,Beadwork,Bhavnagar,443,Secondary,Handicraft,"Bhavnagar, nestled in Gujarat, is renowned for its exquisite beadwork, a centuries-old craft that embodies the region's rich cultural heritage. Skilled artisans intricately weave tiny beads into stunning designs, creating jewelry, accessories, and embellishments that reflect the vibrant spirit of Gujarat. Bhavnagar's beadwork is not just a form of art but also a symbol of tradition and identity, cherished by locals and admired by connoisseurs worldwide for its craftsmanship and beauty.",No,https://drive.google.com/file/d/1yTBhR9Ml7WUhGFYrz6H67ColE1rXxm31/view?usp=drive_link,DC Handicraft
Gujarat,Peanut butter,Bhavnagar,443,Tertiary,Food Processing,"Renowned for its high-quality production, Bhavnagar in Gujarat is emerging as a hub for premium peanut butter manufacturing. The peanut butter crafted here is rich in nutrients, heart-friendly, and an excellent source of protein. With a commitment to sustainability and global exports, Bhavnagars peanut butter industry is a testament to the regions agricultural and manufacturing excellence",No,https://drive.google.com/file/d/1VVNWiMstVqHy8phEHzS43dMiLXt5Mmh4/view?usp=drive_link,Ministry of Food Processing Industries.
Gujarat,Groundnuts/ Peanuts,Botad,676,Primary,Agriculture,"Groundnuts and Peanuts from Botad, Gujarat are a true delicacy of nature, imbued with a rich and earthy flavor that is both robust and subtle. Each nut is carefully cultivated by skilled farmers using sustainable and responsible practices, ensuring the highest quality and purity. Whether roasted, ground into butter, or used in a variety of traditional dishes, these humble nuts have the power to delight the senses and nourish the body and soul.",No,https://drive.google.com/file/d/1J6ui6yVZmQVFL5tb8yGstjjDO5Xyi-3V/view?usp=drive_link,Ministry of Agriculture & Farmers' Welfare
Gujarat,Jining,Botad,676,Secondary,Manufacturing,"Botad, Gujarat, plays a vital role in the cotton ginning industry, where raw cotton is processed to extract seeds and impurities. Known for its advanced ginning facilities and skilled workforce, Botad ensures the production of high-quality cotton fibers that meet stringent standards. This essential step in the cotton supply chain underscores Botad's significance in India's textile sector, contributing to the production of premium fabrics enjoyed globally for their quality and durability.",No,https://drive.google.com/file/d/1sKdGyRPCU_8oyv5tToCrR-_50lsRrpsj/view?usp=drive_link,MSME
Gujarat,Sankheda furniture,Chhota Udaipur,668,Tertiary,Handicraft,"Adorned with intricate hand-carved motifs and embellished with vibrant colors that sing with life, Sankheda furniture captures the essence of Gujarat's rich cultural heritage in every curve and contour. From intricately designed swings to ornate chairs and tables, Sankheda furniture adds a touch of rustic elegance to any space, transforming it into a warm and inviting haven that soothes the senses and enlivens the soul.",Yes,https://drive.google.com/file/d/1ag6RwCzDsWq3yCEEr-iKE8zR9QiM0zQ3/view?usp=drive_link,DC Handicraft
Gujarat,Pithora Painting,Chhota Udaipur,668,Secondary,Handicraft,"Pithora painting, the resplendent folk art that originated in Chhota Udaipur, Gujarat, is a true masterpiece of colors, patterns, and symbolism that embodies the rich cultural heritage of the region. Created by skilled artisans using natural pigments and traditional techniques that have been passed down for generations, each Pithora painting is a stunning tapestry of intricate motifs, bold hues, and intricate geometric shapes that dance with life and energy.",Yes,https://drive.google.com/file/d/1g07kogMaHkt5n7y7REVUidkEuGxPc_bg/view?usp=drive_link,DC Handicraft
Gujarat,Furniture Products,Chhota Udaipur,668,Primary,Handicraft,"Furniture Products from Chhota Udaipur, Gujarat, are celebrated for their durability, intricate craftsmanship, and unique designs. Crafted by skilled artisans using high-quality wood and other materials, the furniture often reflects the rich cultural heritage of the region, blending traditional artistry with modern functionality. From intricately carved chairs and tables to robust storage solutions, the products are both aesthetically pleasing and long-lasting.",No,https://drive.google.com/file/d/1z_7t0fmhaqZb_B39QxPnWRqWWGh2F47c/view?usp=drive_link,Ministry of MSME
Gujarat,Corn Products,Dahod,445,Primary,Food Processing,"Dahod, nestled in Gujarat, is renowned for its diverse range of corn products, reflecting the region's agricultural abundance. From wholesome corn flour to crispy corn chips, Dahod offers a myriad of delicious options derived from this versatile grain. The natural sweetness and nutritional value of Dahod's corn products make them a popular choice for both traditional and modern cuisines, showcasing the district's commitment to culinary innovation and farm-to-table goodness.",No,https://drive.google.com/file/d/11QXGLG6-oiz7NuMRMFRygVGZiUZLltlp/view?usp=drive_link,Ministry of Food Processing
Gujarat,Soyabean/Soya Based Products,Dahod,445,Secondary,Agriculture,"This versatile legume is the star ingredient in a range of scrumptious products that have captivated the hearts and taste buds of foodies everywhere. From protein-rich soy milk, flavorful tofu, and savory soy chunks, to crispy soy nuts and delectable soy-based snacks, the skilled artisans of Dahod have transformed this humble legume into a culinary marvel.",No,https://drive.google.com/file/d/1xHFQ4lqpGxlSTNHl6hEYSUmzeI9VE2iw/view?usp=drive_link,Ministry of Agriculture & Farmers' Welfare
Gujarat,Kharif Maiz (Agro),Dahod,445,Tertiary,Agriculture,"Sourced from the fertile lands of Dahod in Gujarat, Kharif Maz stands as a testament to the regions rich agricultural heritage. Grown with dedication during the Kharif season, this maize variety is known for its high yield, robust flavor, and superior quality. ",No,https://drive.google.com/file/d/1PQxFFu-BtIbn-fAIw5AqauzR1CdO2tRn/view?usp=drive_link,Ministry of Agriculture & Farmers Welfare
Gujarat,Ravi Maiz (Agro),Dahod,445,Others,Agriculture,"Sourced from the fertile lands of Dahod in Gujarat, Ravi Maz stands as a testament to the regions rich agricultural heritage. Grown with dedication during the Ravi season, this maize variety is known for its high yield, robust flavor, and superior quality. ",No,https://drive.google.com/file/d/1jcTJL_2NvkeP2XX6QO-WUoje-Em1xnPI/view?usp=drive_link,Ministry of Agriculture & Farmers Welfare
Gujarat,Nagali Products,Dang,444,Primary,Food Processing,"The Nagali products from Dahod are a must-try for anyone looking to savor the authentic taste of Gujarat. From crispy and savory Nagali snacks to indulgent and sweet Nagali desserts, these products are an exquisite blend of flavor, texture, and aroma, made with the finest ingredients and using time-honored techniques.",No,https://drive.google.com/file/d/1FuBajqxUFC8iXvslqd8TYAcfSnl54ZzY/view?usp=drive_link,Ministry of Food Processing
Gujarat,Strawberry & Strawberry Products,Dang,444,Secondary,Food Processing,"Dang, a picturesque district in Gujarat, India, is renowned for its luscious strawberries and their delectable derivatives. The skilled farmers of Dang harvest these strawberries at their peak, and their products range from juicy jams, mouth-watering preserves, and heavenly ice-creams, to tantalizing confectioneries and beverages, all made with utmost care and using natural ingredients.",No,https://drive.google.com/file/d/1-v4uSXAtz1f1hPbijv3qR5wW2V2VTyNH/view?usp=drive_link,Ministry of Food Processing
Gujarat,Khambhaliya Shawl,Devbhoomi Dwarka,674,Secondary,Handloom,"Devbhoomi Dwarka, Gujarat, is celebrated for its exquisite Khambhaliya shawls, crafted with precision and passion by skilled artisans. These shawls are renowned for their intricate designs, vibrant colors, and luxurious feel, making them a cherished accessory for discerning individuals. Woven with care using traditional techniques passed down through generations, each Khambhaliya shawl embodies the rich cultural heritage of Devbhoomi Dwarka, offering warmth, elegance, and timeless style.",No,https://drive.google.com/file/d/1VOIphOtuCNu0UtG8VHLS9PvxH6GhmWkX/view?usp=drive_link,DC Handloom
Gujarat,Marine & Fisheries/ Dholdara Fish,Devbhoomi Dwarka,674,Primary,Marine,"Devbhoomi Dwarka, Gujarat, boasts the renowned Dholdara fish, prized for its delicate flavor and tender texture. Caught sustainably off the coastal waters, this local delicacy is a favorite among seafood enthusiasts. Devbhoomi Dwarka's fishing community utilizes traditional methods passed down through generations, ensuring the preservation of marine ecosystems while providing a delectable treat for gastronomes. The Dholdara fish exemplifies the region's rich maritime heritage and commitment to responsible fishing practices.",No,https://drive.google.com/file/d/13CNFBR5fDzlt7hoxd5sURerzm2rC6VCB/view?usp=drive_link,Department of Fisheries
Gujarat,Salt,Devbhoomi Dwarka,674,Tertiary,Food Processing,"Devbhoomi Dwarka, Gujarat, is renowned for its premium-quality salt, harvested from the pristine waters of the Arabian Sea. Blessed with abundant sunshine and coastal breezes, the region's salt pans yield pure, crystalline salt known for its exceptional taste and mineral content. Devbhoomi Dwarka's salt production reflects a harmonious blend of traditional techniques and modern innovation, ensuring a product that satisfies both culinary needs and discerning palates with its natural purity and flavor.",No,https://drive.google.com/file/d/1A6OIkjnKSsezvuPmP0SPYEvhU5Vm53cJ/view?usp=drive_link,Ministry of Food Processing
Gujarat,Software & Financial Services,Gandhinagar,446,Primary,Others,"Gandhinagar, Gujarat is a dynamic hub of software and financial services. The region is home to some of the most cutting-edge IT companies, that deliver transformative solutions to clients around the world. The financial services sector in Gandhinagar is equally impressive, offering an array of financial products and services, from investment management and insurance to banking and lending.",No,https://drive.google.com/file/d/1mCBo2jw79W0c23_YBEkqPW1xUDM6hFBK/view?usp=drive_link,MeitY
Gujarat,Wood work/ Block Making,Gandhinagar,446,Secondary,Handicraft,"Gandhinagar, Gujarat is renowned for its exquisite woodwork and block making, a centuries-old art. The adept artisans of this region create stunning pieces of furniture and decorative items using traditional techniques and locally sourced wood. Block making involves the skilled creation of hand-carved blocks used for printing on fabrics and textiles, resulting in beautiful and intricate design.",No,https://drive.google.com/file/d/1NP0M3c28Q2hkUbL-128-Je_qoKr-lEDU/view?usp=drive_link,DC Handicraft
Gujarat,Kesar Mango,Gir Somnath,675,Primary,Agriculture,"Indulge in the essence of Gujarat's Gir Somnath with its prized Kesar Mango. Renowned for its vibrant saffron hue and luscious sweetness, this mango variety delights with its unique flavor profile and aromatic allure. Grown amidst the serene landscapes of Gir Somnath, each bite unveils a burst of tropical goodness, making it a cherished delicacy adored by mango enthusiasts worldwide.",Yes,https://drive.google.com/file/d/1CqheM5uKAVuhIeFRpRcSuGlJcI0ZE6y9/view?usp=drive_link,Ministry of Agriculture & Farmers' Welfare
Gujarat,Marine & Fisheries Industry,Gir Somnath,675,Secondary,Marine,"Gujarat's Marine & Fisheries Industry, particularly in the Gir Somnath district, is a vital part of the state's economy. Gir Somnath, located along the Arabian Sea, boasts a rich coastline that supports a thriving fishing industry. The region is known for its diverse marine life, including prawns, pomfret, and other commercially valuable fish species. The industry provides livelihoods to thousands of fishermen and contributes significantly to Gujarat's seafood exports. Modern fishing techniques, cold storage facilities, and processing units have further boosted the sector's growth. Additionally, the district is home to key fishing harbors like Veraval, which is one of the largest in India, playing a crucial role in the state's marine economy.",Yes,https://drive.google.com/file/d/1vgNx-4cJI0z42Q1UocP2-m58RAQ8XkBv/view?usp=drive_link,Department of Fisheries
Gujarat,Ceramic Tiles,Himmatnagar/Sabarkantha,458,Primary,Manufacturing,"Whether it's for residential or commercial applications, the ceramic tiles from Himmatnagar are a must-have for anyone looking to add a touch of elegance and sophistication to their spaces. From glossy and textured finishes to intricate patterns and designs, these ceramic tiles are the perfect blend of form and function.",No,https://drive.google.com/file/d/1-RYEcTVhtmJDNL8d30-FtMioE7usMBkP/view?usp=drive_link,MSME
Gujarat,Potato (Cold Storage),Himmatnagar/Sabarkantha,458,Secondary,Agriculture,"Potatoes, a beloved and versatile crop, are grown with care in the fertile soil of Himmatnagar, Gujarat. These tubers, with their earthy exterior and nutritious qualities, have earned a place in the hearts and kitchens of people around the world. To preserve this precious crop, storage facilities have been established in Himmatnagar, where potatoes are carefully stored in ideal conditions to ensure their longevity. and quality.",No,https://drive.google.com/file/d/1FhKJwd13pOjbIxa0xYslqQ8PeL6l2dYA/view?usp=drive_link,Ministry of Agriculture & Farmers' Welfare
Gujarat,Terracotta,Himmatnagar/Sabarkantha,458,Tertiary,Handicraft,"Discover the timeless artistry of Himmatnagar /Sabarkantha's Terracotta. Crafted with meticulous skill and centuries-old techniques, each piece embodies the region's rich cultural heritage. From intricately designed pottery to sculptural masterpieces, Terracotta reflects the artisans' dedication to preserving tradition. With earthy tones and rustic charm, these handcrafted creations add warmth and character to any space, making them cherished treasures.",No,https://drive.google.com/file/d/1XIoq6vBbYt-Nj-5ftD1RjmjJyeLDQtZb/view?usp=drive_link,DC Handicraft
Gujarat,Bandhani,Jamnagar,447,Primary,Handloom,"Bandhani is a stunning textile art form that originates from the vibrant district of Jamnagar in Gujarat, India. This technique involves the meticulous tying and dyeing of fabric using traditional methods, resulting in exquisite patterns and colors. The artisans of Jamnagar are known for their skill in creating intricate designs using small knots, which are then dipped in vibrant dyes to produce stunning, eye-catching patterns.",Yes,https://drive.google.com/file/d/1vJfYOW2CDjBZuDh2nhtGpctUDGy3KtYl/view?usp=drive_link,DC Handloom
Gujarat,Petrochemcials,Jamnagar,447,Secondary,Others,"Explore the industrial prowess of Jamnagar's Petrochemicals sector. Anchored by cutting-edge technology and sustainable practices, it drives Gujarat's economic engine. From refining to manufacturing, this sector plays a vital role in meeting global energy demands while prioritizing environmental responsibility. With a focus on innovation and efficiency, Jamnagar's Petrochemicals industry exemplifies Gujarat's commitment to industrial excellence and a greener future.",No,https://drive.google.com/file/d/1p5By7J5Gf4JehDdi4KhjLaepA56JtU8e/view?usp=drive_link,Department of Chemicals and Petrochemicals
Gujarat,Brass Parts,Jamnagar,447,Tertiary,Manufacturing,"Embrace the craftsmanship of Jamnagar's Brass Parts industry, renowned for its precision and quality. With a legacy steeped in metalworking tradition, artisans meticulously forge each component, ensuring durability and functionality. From intricate fittings to robust hardware, these brass parts adorn homes and industries worldwide, reflecting Gujarat's mastery in metallurgy.",No,https://drive.google.com/file/d/1jIHlbTX_xN8tMbDpnoCujjOPT4oUuu2r/view?usp=drive_link,MSME
Gujarat,Groundnuts/Peanuts (Peanut Based Products),Junagadh,448,Primary,Food Processing,"Delight in the culinary treasures of Junagadh's Peanuts, Groundnuts and Peanut Based Products, a testament to Gujarat's agricultural ingenuity. From creamy peanut butter to crunchy chikki, each creation bursts with wholesome flavor and nutritional goodness. Sourced from fertile soils and expertly processed, these products showcase the versatility of peanuts in traditional and modern cuisine. With a perfect balance of taste and health benefits, Junagadh's Peanuts, Groundnuts and Peanut Based Products elevate snacking to a delightful experience.",No,https://drive.google.com/file/d/1NSTn4okaPd89QmVhNwoSnSyNdOvYYPCC/view?usp=drive_link,Ministry of Food Processing
Gujarat,Beadwork,Junagadh,448,Secondary,Handicraft,"Immerse yourself in the exquisite artistry of Junagadh's Beadwork, a testament to Gujarat's rich cultural tapestry. Crafted with intricate precision and vibrant hues, each beadwork piece narrates stories of tradition and craftsmanship. From intricate jewelry to ornate textiles, these beads embellish attire and decor with unparalleled elegance. Passed down through generations, Junagadh's Beadwork celebrates the region's artistic heritage.",No,https://drive.google.com/file/d/1yTBhR9Ml7WUhGFYrz6H67ColE1rXxm31/view?usp=drive_link,DC Handicraft
Gujarat,Mango,Junagadh,448,Tertiary,Agriculture,"Savor the succulent sweetness of Junagadh's Mango, celebrated for its juicy flesh and tropical aroma. Grown in the fertile soils of Gujarat, each mango embodies the essence of sun-kissed perfection. From the velvety texture to the delectable flavor, it's a testament to nature's bounty. Whether enjoyed fresh or incorporated into desserts and beverages, Junagadh's mangoes offer a delightful taste of summer, leaving taste buds longing for more.",No,https://drive.google.com/file/d/1Od_uMPaUPw2SNG07KLjsXHD-bfqvUZEw/view?usp=drive_link,Ministry of Agriculture & Farmers' Welfare
Gujarat,Agro Products,Kheda (Nadiad),450,Primary,Food Processing,"The verdant plains of Kheda in Gujarat, specifically in the bustling town of Nadiad, are a treasure trove of agricultural products. The region is home to a rich variety of crops, including rice, wheat, pulses, and sugarcane. They are then processed into a range of delicious and nutritious food products, from aromatic basmati rice to sweet jaggery and flavorful spices.",No,https://drive.google.com/file/d/1nb9XEpHEDCmKDmkXRmaf5ztR3Iu8TqCg/view?usp=drive_link,Ministry of Food Processing
Gujarat,Mathia,Kheda (Nadiad),450,Secondary,Food Processing,"Savor the crispy delight of Kheda's Mathia Papad, a culinary gem from Nadiad, Gujarat. Crafted with care and expertise, these thin, crunchy discs are made from lentil flour and infused with a blend of aromatic spices. Whether enjoyed as a standalone snack or paired with meals, Mathia Papad tantalizes taste buds with its savory flavor and satisfying crunch, representing the rich gastronomic heritage of Gujarat's heartland.",No,https://drive.google.com/file/d/1dGjIb3NiRBgFOw2WDr8IAaM32mQbaAlv/view?usp=drive_link,Ministry of Food Processing
Gujarat,Handicraft Items,Kachch,449,Primary,Handicraft,"Discover the intricate beauty of Kachch's Handicraft Items, each a masterpiece crafted with skill and passion. From vibrant textiles to ornate pottery, these creations reflect the region's rich cultural heritage and artistic tradition. Handwoven fabrics, intricate embroidery, and meticulously carved wooden artifacts showcase the craftsmanship and attention to detail that make Kachch's handicrafts truly special. Every piece tells a story, celebrating Gujarat's artistic legacy and timeless creativity.",Yes,https://drive.google.com/file/d/1tyupxJBsP5Yf62IWxTLl4dNWS0jFx2Z_/view?usp=drive_link,DC Handicraft
Gujarat,Green Dates,Kachch,449,Secondary,Agriculture,"Experience the unique flavor of Gujarat's Kachch Green Dates, a natural delicacy renowned for its refreshing taste and health benefits. Grown amidst the arid landscapes of Kachch, these dates boast a vibrant green hue and a tender, juicy texture. Rich in essential nutrients and antioxidants, they offer a delicious snack that energizes the body and delights the palate. Kachch Green Dates epitomize the region's commitment to wholesome living and culinary excellence.",No,https://drive.google.com/file/d/1tdSD6P7K2mEl3Xky8Lg3yN0EAvTJYkL_/view?usp=drive_link,Ministry of Agriculture & Farmers' Welfare
Gujarat,Salt,Kachch,449,Tertiary,Food Processing,"Salt, the precious mineral that is a ubiquitous ingredient in our daily lives, takes on an ethereal quality in the salt pans of Kutch, Gujarat. Here, the glistening white crystals of salt form an otherworldly landscape that shimmers like a mirage in the desert sun. With its delicate flavor andexquisite texture, Kutch salt is a true delicacy that adds a touch of sophistication and luxury to any dish.",No,https://drive.google.com/file/d/1Ourx3VBJEFSa-311kvgmj6hr6vVC0DAN/view?usp=drive_link,Ministry of Food Processing
Gujarat,Bhujodi Shawl weaving,Kachchh,449,Others,Handloom,"Woven with intricate artistry in the heart of Kachchh, Gujarat, the Bhujodi Shawl is a timeless piece of craftsmanship. Renowned for its vibrant colors, fine textures, and traditional patterns, each shawl is a testament to the regions rich weaving heritage.",No,https://drive.google.com/file/d/14Va7MKlrWfGyTPXOx5wUgegbURUYh0Bh/view?usp=drive_link,Ministry of Textiles
Gujarat,Hand Embroidery,Kachchh,449,Others,Handloom,"Hand Embroidery from Kachchh is a striking representation of the regions rich cultural heritage and craftsmanship. This embroidery style is often characterized by colorful threads, mirror work, and geometric patterns that reflect the diverse traditions of the local communities. Skilled artisans from Kachchh use traditional techniques passed down through generations, creating exquisite patterns on fabrics like cotton, silk, and wool.",No,https://drive.google.com/file/d/1raexggRKwak_gfVWplMsIhUzeGxXZ2bi/view?usp=drive_link,Ministry of Textiles
