State,Product,District,LGD Code,Category,Sector,Description,GI Status,Photo,Ministry/ Department
Andaman and Nicobar Islands,Coconut & Coconut based products,Nicobars,603,Primary,Agriculture,"The Nicobar Islands are known for their abundant coconut plantations, that make available coconut oil, coconut milk, coconut water, and copra (dried coconut meat used for oil extraction). The islands are also known for their traditional handicrafts made from coconut shells and fibers, such as baskets and mats.",No,https://drive.google.com/file/d/1ZKef7mLS4iub1jTlqv9gbc8oBhJ8ljct/view?usp=drive_link,Ministry of Agriculture & Farmers' Welfare
Andaman and Nicobar Islands,Fisheries/Marine products,North and Middle Andaman,632,Primary,Marine,"The North and Middle Andaman islands, are known for their rich marine life and as a result, fishing and the production of marine products is a significant part of the local economy. These products include a wide variety of fish, shellfish, and other seafood, which are popular in the local market and also exported to other parts of the country.",No,https://drive.google.com/file/d/1caPuTWCA35HHLk0aEbqhiLlPAWAlB3zQ/view?usp=drive_link,Department of Fisheries
Andaman and Nicobar Islands,Marine Products,South Andamans,602,Primary,Marine,"A delight for seafood enthusiasts, South Andaman has a thriving sector of marine products. Jumbo prawns, plump, juicy shrimps, fish cooked in an olio of masalas, stir fried squid - a panoply of marine products are safely, following top standards of hygiene are processed in this district.",No,https://drive.google.com/file/d/15DIayCr05l9033ZxDtvkQHXa_qCGHasz/view?usp=drive_link,Department of Fisheries
Andhra Pradesh,Coffee (Araku),Alluri Sitarama Raju,745,Primary,Agriculture,"Andhra Pradesh is one of the major coffee producing states in India. The state is known for its high-quality Arabica and Robusta coffee beans. The coffee grown in Andhra Pradesh is known for its unique flavor profile, with notes of chocolate, nuts, and spices. The coffee is mostly grown in the hilly regions at an altitude of 900-1500m above sea level.",Yes,https://drive.google.com/file/d/18ptepDrMFsm5l6OVZl_jcwOOz9-lp_Hb/view?usp=drive_link,Ministry of Agriculture & Farmers' Welfare
Andhra Pradesh,Bamboo Craft,Alluri Sitarama Raju,745,Secondary,Handicraft,"Crafted with finesse in Andhra Pradesh's Alluri Sitarama Raju district, Bamboo Craft exemplifies the region's rich artisanal heritage. Skillfully woven by local artisans, these pieces showcase intricate designs and sturdy construction, reflecting the eco-conscious ethos of the community. Each creation embodies a blend of tradition and innovation, making Bamboo Craft not just a product, but a testament to the cultural legacy of the region.",No,https://drive.google.com/file/d/1HT-KGuEaGPfvf7jbfYc-_II_o7x-T6Y-/view?usp=drive_link,DC Handicraft
Andhra Pradesh,Rock Bee Honey,Alluri Sitarama Raju,745,Tertiary,Food Processing,"Rock Bee Honey from Alluri Sitarama Raju, Andhra Pradesh, is a natural delicacy known for its rich flavor, golden hue, and numerous health benefits. Collected from wild rock bees in the forests of the region, this honey is prized for its purity and organic nature. The unique floral diversity of the area lends the honey a distinct taste and aroma, making it a sought-after product for both culinary and medicinal uses. ",no ,https://drive.google.com/file/d/10TFfY2JQ1s4t3wqcsUMq9ZDFRPGQNJCi/view?usp=sharing,Ministry of Agriculture & Farmers' Welfare
Andhra Pradesh,Etikoppaka Lacquerware/Wooden Toys,Anakapalli,744,Primary,Handicraft,"Anakapalli is a town located in the Indian state of Andhra Pradesh. It is known for its traditional wooden toy industry, particularly for Etikoppaka Wooden Toys. These toys are made using locally sourced light-weight wood, primarily from the cashew tree, and are crafted using traditional techniques passed down through generations.",Yes,https://drive.google.com/file/d/1eToIFetXrq90IykYyvLkl2SMHug2YI8f/view?usp=drive_link,DC Handicraft
Andhra Pradesh,Palm Leaf,Anakapalli,744,Secondary,Agriculture,"Hailing from the picturesque district of Anakapalli in Andhra Pradesh, Palm Leaf products are meticulously woven by skilled artisans, showcasing the natural beauty and versatility of palm leaves. From intricately designed mats to eco-friendly utensils, each creation reflects the ingenuity and dedication of the local community. Embracing sustainable practices, Palm Leaf products serve as both functional commodities and artistic expressions, embodying the essence of rural Andhra Pradesh.",No,https://drive.google.com/file/d/1l7BfXhUYb7WedyrbKiKzchGaHThycfzi/view?usp=drive_link,Ministry of Agriculture & Farmers' Welfare
Andhra Pradesh,Payakaraopet Silk Sarees,Anakapalli,744,Tertiary,Handloom,"Originating from the looms of Anakapalli in Andhra Pradesh, Payakaraopet Silk Sarees epitomize timeless elegance and craftsmanship. Woven with precision and adorned with exquisite motifs, these sarees are a celebration of tradition and artistry. Payakaraopet Silk Sarees not only encapsulate the cultural heritage of the region but also represent the skilled craftsmanship passed down through generations, making them cherished attire for special occasions.",No,https://drive.google.com/file/d/1syaF69l7vPmPBad9nPVnUXBX8Bwm8PH_/view?usp=drive_link,DC Handloom
Andhra Pradesh,Cotton/Jean Pants,Anantapuram (Anantapur),502,Primary,Textile,"With a strong textile heritage and many local textile mills and factories, the city of Anantapuram in Andhra Pradesh produces a range of high-quality cotton and denim products, including pants. The city's cotton and denim products are both in high demand locally and exported to other regions of India.",No,https://drive.google.com/file/d/1sfpzfXl_C848ZtRcjce9cB1C5pGvQeHy/view?usp=drive_link,Ministry of Textile
Andhra Pradesh,Dharmavaram Silk Sarees,Ananthpuram (Anantapur),502,Secondary,Handloom,"Sourced from the looms of Ananthpuram (Anantapur) in Andhra Pradesh, Dharmavaram Silk Sarees epitomize timeless sophistication and craftsmanship. Renowned for their rich colors, intricate patterns, and lustrous texture, these sarees are a symbol of elegance and tradition. Woven with meticulous care by skilled artisans, each saree tells a story of cultural heritage and meticulous craftsmanship.",Yes,https://drive.google.com/file/d/1IqeJSfR8n7T_bG2HFaPJl_43lkC1niW1/view?usp=drive_link,DC Handloom
Andhra Pradesh,Cotton / Jean Pants,Annamayya (Rayachoty),753,Primary,Textile,"Cotton/Jean pants are produced in Annamaya from a combination of cotton and denim (jean) fabric. Cotton is a natural, breathable material that is comfortable to wear and easy to care for, while denim is a durable, long-lasting fabric that is often used in pants and jeans.",No,https://drive.google.com/file/d/1T8MZZDBt59SogvXrl3Nd1GRccbQaYn3T/view?usp=drive_link,Ministry of Textile
Andhra Pradesh,Red Sander & Wood Carvings,Annamayya (Rayachoty),753,Secondary,Handicraft,"Carved with precision and adorned with intricate details, these pieces of art exude a timeless allure. Utilizing locally sourced red sandalwood, artisans bring to life a variety of exquisite designs, each echoing the rich cultural tapestry of the region. From decorative figurines to functional pieces, Red Sander & Wood Carvings stand as a testament to the skilled hands and creative vision of the artisans, preserving traditions for generations to come.",No,https://drive.google.com/file/d/1NL5pSyOW0ElakTQ8LNEqA7dqkcLoauIw/view?usp=drive_link,DC Handicraft
Andhra Pradesh,Raja Rani Dolls,Annamayya (Rayachoty),753,Tertiary,Handicraft,"Raja Rani Dolls, crafted in Rayachoty, Andhra Pradesh, reflect the rich cultural heritage of the region. Made with intricate detail and vibrant colors, these dolls depict the royal court of ancient times, showcasing the elegance and grandeur of traditional Indian attire. Each doll is a miniature masterpiece, capturing the essence of Andhra Pradesh's artistic tradition and providing a glimpse into its majestic history.",No,https://drive.google.com/file/d/191Q4yZ5UwuI2a__nhLnwzy6W51NlUHGC/view?usp=drive_link,DC Handicraft
Andhra Pradesh,Applique Work,Annamayya (Rayachoty),753,Others,Handloom,"Applique work from Rayachoty, Andhra Pradesh, is a testament to the region's artistic finesse. Skilled artisans delicately stitch vibrant fabric pieces onto a base, creating stunning motifs and designs. Each piece showcases meticulous craftsmanship and showcases the rich cultural heritage of the area. From intricate patterns to bold colors, this traditional art form brings life and beauty to a variety of textiles, making it a cherished part of Andhra Pradesh's craft legacy.",No,https://drive.google.com/file/d/1hMzn3-l-Jz3rBgU5kIEIx6bw--nV7Pb-/view?usp=drive_link,DC Handloom
Andhra Pradesh,Mandanapalle Silk Sarees,Annamayya (Rayachoty),753,Others,Handloom,"Mandanapalle Silk Sarees from Rayachoty, Andhra Pradesh, epitomize elegance and tradition. Woven with exquisite craftsmanship, these sarees feature intricate motifs and vibrant hues that reflect the cultural richness of the region. Known for their lustrous texture and timeless appeal, each saree is a masterpiece that celebrates the artistry and heritage of Andhra Pradesh's weaving tradition, making it a coveted choice for discerning saree connoisseurs.",No,https://drive.google.com/file/d/1jUDWam5Pt9sP26db6Z-qEjPCk8uhHRVR/view?usp=drive_link,DC Handloom
Andhra Pradesh,Granite Cutting and Polishing,Bapatla,750,Primary,Manufacturing,Bapatla is a small town located in the Indian state of Andhra Pradesh. It is known for its granite cutting and polishing industry. Bapatla is a major hub for granite mining and processing in the state. The town is home to a number of granite cutting and polishing units which process a wide variety of granite that are sourced from nearby quarries.,No,https://drive.google.com/file/d/1f3-pN1uHBLhTbBcDTYZ-NP2gGjCY3xQp/view?usp=drive_link,MSME
Andhra Pradesh,Cotton Bags,Bapatla,750,Secondary,Manufacturing,"Cotton bags from Bapatla, Andhra Pradesh, embody sustainability and style. Handcrafted with locally sourced cotton, these bags are eco-friendly alternatives to plastic. Each bag showcases the artisanal skill of the region, featuring durable stitching and minimalist designs. Perfect for everyday use or as thoughtful gifts, these bags promote environmental consciousness while supporting the livelihoods of local communities, making them a practical and ethical choice for conscientious consumers.",No,https://drive.google.com/file/d/1mMaU_SfpxlNnvWr8ekH3oaoJh0Ij2e72/view?usp=drive_link,MSME
Andhra Pradesh,Chirala Silk Sarees,Bapatla,750,Tertiary,Handloom,"Chirala Silk Sarees from Bapatla, Andhra Pradesh, epitomize timeless elegance. Renowned for their intricate weaving and luxurious texture, these sarees showcase exquisite craftsmanship passed down through generations. Adorned with traditional motifs and vibrant colors, each saree is a symbol of the region's rich cultural heritage and artisanal expertise. Perfect for special occasions or everyday wear, Chirala Silk Sarees are cherished for their unparalleled beauty and sophistication.",No,https://drive.google.com/file/d/1BhoRflbmHYfrgi9KM0cG5TSbZxKcgzqH/view?usp=drive_link,DC Handloom
Andhra Pradesh,Venkatagiri Sarees,Chittoor,503,Primary,Handloom,"Venkatagiri sarees are known for their fine weaving. These sarees are hand-woven and made from premium quality cotton, adorned with intricate patterns that often include gold and silver threads. Venkatagiri sarees are considered a symbol of wealth and status, and are widely sought after by women in India and exported globally.",Yes,https://drive.google.com/file/d/1gXfGSkNHUoAeztnnTW6pMaHpC3Ps2hng/view?usp=drive_link,DC Handloom
Andhra Pradesh,Mango Pulp,Chittoor,503,Secondary,Food processing,"Chittoor is a city in the Indian state of Andhra Pradesh known for its mango pulp production. The region is known for its rich soil and favorable climate conditions, making it ideal for growing a wide variety of mangoes. As a result, the district has a significant food processing industry that produces high-quality mango pulp",No,https://drive.google.com/file/d/1iJ8_U3z-jfrhjNc3eMszOqQL5leu9B8H/view?usp=drive_link,Ministry of Food Processing
Andhra Pradesh,The Glass Beads,Chittoor,503,Tertiary,Handicraft,"Glass beads from Chittoor, Andhra Pradesh, exude artistic brilliance and cultural significance. Handcrafted by skilled artisans, these beads showcase vibrant colors and intricate designs that reflect the region's rich heritage. Used in traditional jewelry and embellishments, each bead tells a story of craftsmanship and tradition, making them a cherished part of Andhra Pradesh's cultural identity. Whether adorning attire or accessories, Chittoor's glass beads add a touch of elegance and tradition to any ensemble.",No,https://drive.google.com/file/d/1ao_lQFKqHGzZte7Vdwe1rFVOJQ3XExWn/view?usp=drive_link,DC Handicraft
Andhra Pradesh,Kollangantu Tie &Dye Check Lungies,Chittoor,503,Others,Textile,"Kollangantu Tie & Dye Check Lungies from Chittoor, Andhra Pradesh, are a fusion of traditional artistry and contemporary style. Crafted using a unique tie-and-dye technique, these lungies feature vibrant colors and intricate check patterns, making each piece truly unique. With their lightweight and breathable fabric, they offer both comfort and style, making them perfect for everyday wear or special occasions, reflecting the region's rich textile heritage.",No,https://drive.google.com/file/d/1kRcWl73XWsmDUg4-DsyMzW4kLq0N9N-5/view?usp=drive_link,Ministry of Textile
Andhra Pradesh,Teracotta,Chittoor,503,Others,Handicraft,"Teracotta from Chittoor, Andhra Pradesh, showcases the region's rich artistic heritage and craftsmanship. Handcrafted by skilled artisans, these clay creations come to life with intricate detailing and earthy colors. From delicate figurines to functional pottery, each piece reflects the cultural traditions and stories of the region. Whether used as decorative accents or everyday utensils, Chittoor's teracotta products bring a touch of rustic charm and authenticity to any space.",No,https://drive.google.com/file/d/1lpsUI7qU9ymeGUphU654efvFZTWJVyVC/view?usp=drive_link,DC Handicraft
Andhra Pradesh,Natural banana fibres,Dr BR Ambedkar Konaseema,747,Others,Manufacturing,"Natural banana fibers from Dr. BR Ambedkar Konaseema, Andhra Pradesh, represent a sustainable and eco-friendly alternative to traditional textiles. Harvested from banana plants, these fibers are known for their strength, durability, and biodegradability. Handcrafted by skilled artisans, they are transformed into a range of products, from textiles to handicrafts, showcasing the region's commitment to environmental consciousness and traditional craftsmanship.",No,https://drive.google.com/file/d/1MA5tyG3ZEY6Avv_GJsmkQpFPJthJEuWq/view?usp=drive_link,MSME
Andhra Pradesh,Bandaru Lanka Sarees,Dr BR Ambedkar Konaseema,747,Others,Handloom,"Bandaru Lanka Sarees from Dr. BR Ambedkar Konaseema, Andhra Pradesh, are a celebration of tradition and elegance. Handwoven by skilled artisans, these sarees feature intricate motifs and vibrant colors that reflect the cultural richness of the region. Known for their soft texture and timeless appeal, each saree is a masterpiece that captures the essence of Andhra Pradesh's weaving heritage.",No,https://drive.google.com/file/d/1P3OjNGf0vjpdmaTO8VWaU0YFN2wl_UUN/view?usp=drive_link,DC Handloom
Andhra Pradesh,Angara Sarees,Dr BR Ambedkar Konaseema,747,Others,Handloom,"Angara Sarees from Dr. BR Ambedkar Konaseema, Andhra Pradesh, epitomize grace and tradition. Handwoven by skilled artisans, these sarees feature intricate zari work and vibrant hues that exude opulence. Each saree is a testament to the region's rich weaving heritage, showcasing impeccable craftsmanship and attention to detail. Perfect for special occasions, Angara Sarees add a touch of timeless elegance to any wardrobe, making them treasured heirlooms for generations to come.",No,https://drive.google.com/file/d/1P5vkrl6LNTEiUBFAT6MN-D24rOJT5LKU/view?usp=drive_link,DC Handloom
Andhra Pradesh,Coconut & Coir,Dr BR Ambedkar Konaseema,747,Primary,Agriculture,"Konaseema is a region located in the East Godavari district of Andhra Pradesh, India. It is known for its rich coconut and coir industry. The region is situated along the coast of Bay of Bengal and has a large number of coconut farms. Konaseema is one of the largest coconut producing regions in Andhra Pradesh.",No,https://drive.google.com/file/d/1N-TIzhAbPmiC2WAvfs1HSS-RWOkCrisF/view?usp=drive_link,Ministry of Agriculture & Farmers' Welfare
Andhra Pradesh,Shrimp,Dr. B. R. Ambedkar Konaseema,747,Secondary,Marine,"The district of Konaseema is known for its rich seafood culture, particularly for its shrimp. The region is situated along the coast of Bay of Bengal and has a large number of shrimp farms. The shrimp from Konaseema is known for its sweet taste, delicate texture and nutritional value. They are caught using traditional fishing methods and are known for their freshness and quality.",No,https://drive.google.com/file/d/1E8uEHDUDMMPiB7aNNjdxbzDRAaYRDttv/view?usp=drive_link,Department of Fisheries
Andhra Pradesh,Oil & Natural Gas,Dr. B. R. Ambedkar Konaseema,747,Tertiary,Others,"The district of Konaseema is known for its rich deposits of oil and natural gas. The region has a number of oil and gas fields that are operated by national and international oil companies. The oil and gas extracted from the fields are used to generate electricity, fuel vehicles, and to produce a wide variety of products.",No,https://drive.google.com/file/d/18EJ1tTln49s1K51Xx8tpgpXfcpr12hLf/view?usp=drive_link,Ministry of Petroleum & Natural Gas
Andhra Pradesh,Pasalapudi Sarees,Dr BR Ambedkar Konaseema,747,Others,Handloom,"Pasalapudi Sarees from Dr. BR Ambedkar Konaseema, Andhra Pradesh, epitomize traditional elegance. Handwoven by skilled artisans, these sarees boast intricate designs and vibrant colors inspired by the region's cultural heritage. Each saree is a work of art, meticulously crafted to perfection, reflecting the rich weaving tradition of Andhra Pradesh. With their lightweight and luxurious feel, Pasalapudi Sarees are ideal for special occasions, offering a timeless charm that captivates admirers.",No,https://drive.google.com/file/d/1bz9bSr9mSBbrsr7YOQE7JCv65-SMb6gV/view?usp=drive_link,DC Handloom
Andhra Pradesh,"Fruit Based Food Products (Pickles, Mango Jelly, Fruit Pulp, Cashew nuts, Lemon extracts)",East Godavari,505,Primary,Food processing,"With fertile soil and a favorable climate, East Godavari is ideal for growing an array of fruits like mangoes, lemons, cashew nuts, and others. The district has a thriving food processing industry that produces an extensive range of fruit-based products such as pickles, mango jelly, fruit pulp, cashews, and lemon extracts.",No,https://drive.google.com/file/d/1sTNaMIlKCcf2Pf9voHM5y1D-VvZCKz2v/view?usp=drive_link,Ministry of Food Processing
Andhra Pradesh,Ratnam Pens,East Godavari,505,Secondary,Manufacturing,"Ratnam pens from East Godavari, Andhra Pradesh, are synonymous with precision and craftsmanship. These meticulously crafted writing instruments boast a legacy of excellence, dating back generations. Handmade by skilled artisans, each pen combines traditional techniques with modern design, resulting in a seamless blend of functionality and elegance. Whether used for everyday writing or as a symbol of sophistication, Ratnam pens exemplify the artistry and ingenuity of Andhra Pradesh's pen-making tradition.",No,https://drive.google.com/file/d/1UPG64ld7xxPwXE0Qy05KRzGYAZeiAaqy/view?usp=drive_link,MSME
Andhra Pradesh,White Wood Birds,East Godavari,505,Tertiary,Handicraft,"White Wood Birds from East Godavari, Andhra Pradesh, are exquisite examples of traditional craftsmanship and natural beauty. Hand-carved by skilled artisans, these delicate birds capture the grace and charm of their real-life counterparts. Crafted from locally sourced white wood, each piece reflects the region's reverence for nature and commitment to sustainable practices. Perfect for home decor or as thoughtful gifts, these intricately detailed birds bring a touch of elegance and serenity to any space.",No,https://drive.google.com/file/d/11Dizmgbh_zwXGLbxZjgajiBuA3nCxCZg/view?usp=drive_link,DC Handicraft
Andhra Pradesh,Pulagurta Clothing Shirting & Sarees,East Godavari,505,Others,Textile,"Muramunda Cotton Shirting & Sarees from East Godavari, Andhra Pradesh, epitomize comfort and style. Handwoven by skilled artisans, these fabrics boast a soft texture and breathable feel, perfect for everyday wear. Featuring subtle patterns and earthy hues, each piece reflects the region's traditional weaving techniques and commitment to quality. Whether tailored into shirts or draped as sarees, Muramunda Cotton fabrics offer a blend of versatility and elegance, ideal for any occasion.",No,https://drive.google.com/file/d/1jUDWam5Pt9sP26db6Z-qEjPCk8uhHRVR/view?usp=drive_link,Ministry of Textile
Andhra Pradesh,Muramunda Cotton Shirting & Sarees,East Godavari,505,Others,Textile,"Muramunda Cotton Shirting & Sarees from East Godavari, Andhra Pradesh, epitomize comfort and style. Handwoven by skilled artisans, these fabrics boast a soft texture and breathable feel, perfect for everyday wear. Featuring subtle patterns and earthy hues, each piece reflects the region's traditional weaving techniques and commitment to quality. Whether tailored into shirts or draped as sarees, Muramunda Cotton fabrics offer a blend of versatility and elegance, ideal for any occasion.",No,https://drive.google.com/file/d/120Ux8O96SXOopSVWc_4s5AzkIPC-U6oT/view?usp=drive_link,Ministry of Textile
Andhra Pradesh,Veeravaram Silk Sarees,East Godavari,505,Others,Handloom,"Veeravaram Silk Sarees from East Godavari, Andhra Pradesh, are a symbol of timeless beauty and exquisite craftsmanship. Handwoven by skilled artisans, these sarees feature luxurious silk fabric adorned with intricate motifs and vibrant colors, reflecting the region's rich weaving tradition. Each saree exudes elegance and grace, making it a cherished attire for special occasions and celebrations. With their impeccable quality and stunning design, Veeravaram Silk Sarees are a true testament to Andhra Pradesh's heritage and artistry.",No,https://drive.google.com/file/d/10PgTy5c89m9Os1mvhvb6_GVilPU_L2K4/view?usp=drive_link,DC Handloom
Andhra Pradesh,Dulla Sarees,East Godavari,505,Others,Handloom,"Dulla Sarees from East Godavari, Andhra Pradesh, embody the essence of traditional elegance. Handcrafted by skilled artisans, these sarees feature intricate weaving and vibrant colors, reflecting the rich cultural heritage of the region. Adorned with traditional motifs and fine detailing, each saree is a masterpiece of craftsmanship, perfect for adding a touch of sophistication to any occasion. Dulla Sarees are a testament to the timeless beauty and exquisite artistry of Andhra Pradesh's textile tradition.",No,https://drive.google.com/file/d/13lsN_4OtzM9FZBqZaiNl_EwoZ6QA5Org/view?usp=drive_link,DC Handloom
Andhra Pradesh,Gold Jewellery,Eluru,748,Primary,Handicraft,"Eluru is a city located in the Indian state of Andhra Pradesh. It is known for its traditional gold jewelry industry. The city has a number of goldsmiths and jewelry artisans who are skilled in the craft of designing and making gold jewelry. The gold jewelry from Eluru is characterized by its intricate designs, traditional motifs, and high-quality craftsmanship.",No,https://drive.google.com/file/d/1djUIgrHYZm02dE-SSy6Qx5jNYnt86gGq/view?usp=drive_link,DC Handicraft
Andhra Pradesh,Hand Knotted Carpet weaving,Eluru,748,Secondary,Handicraft,"Hand-knotted carpet weaving in Eluru, Andhra Pradesh, represents a time-honored craft of exquisite skill and artistry. Expert weavers meticulously create each carpet, knot by knot, using traditional techniques passed down through generations. These carpets boast intricate patterns and vibrant colors, adding warmth and luxury to any space. With their exceptional quality and timeless beauty, Eluru's hand-knotted carpets are treasured pieces that reflect the region's rich weaving heritage.",No,https://drive.google.com/file/d/1qzkpKK7J3sgJBgiKdXUkypVEUD5UykOI/view?usp=drive_link,DC Handicraft
Andhra Pradesh,Walking Sticks,Eluru,748,Tertiary,Handicraft,"Walking sticks from Eluru, Andhra Pradesh, offer both practical support and artistic flair. Crafted by skilled artisans, each stick is meticulously shaped from sturdy materials, ensuring reliability on any terrain. These sticks are not only functional but also serve as stylish accessories, often adorned with intricate carvings or decorative accents. With their blend of utility and craftsmanship, Eluru's walking sticks are a testament to the region's tradition of fine woodworking.",No,https://drive.google.com/file/d/18kpTlZyRwhHEE16Eng26eQb1uVhjVObZ/view?usp=drive_link,DC Handicraft
Andhra Pradesh,Nuziveedu Veena,Eluru,748,Others,Handicraft,"The Nuziveedu Veena from Eluru, Andhra Pradesh, is a harmonious blend of tradition and artistry. Handcrafted by skilled artisans, each veena is meticulously carved from fine-quality wood, producing a rich and resonant tone. With its elegant design and impeccable craftsmanship, the Nuziveedu Veena is not just a musical instrument but a cultural symbol, reflecting the region's devotion to preserving the heritage of classical music for generations to come.",No,https://drive.google.com/file/d/1KdtPzDDd_u7UG83-9QEPoC07RhCuh9hT/view?usp=drive_link,DC Handicraft
